Source ID,Source Name,Author,Title,Description,URL,URL To Image,Published At,Content,Film,Aspect,
,Kotaku,Ethan Gach,It Happened To Me: The GameStop Black Friday Deal From Hell,One of my favorite Black Friday traditions is scrolling through GameStop on my phone and getting a bunch of cool games for cheap. Usually it works out just fine. Last weekend it was a nightmare. It’s hard to convey just how terrible navigating the experience …,https://kotaku.com/gamestop-black-friday-nintendo-switch-zelda-1851049114,"https://i.kinja-img.com/image/upload/c_fill,h_675,pg_1,q_80,w_1200/1130aca518bc7246e79adc990bcfd93a.jpg",2023-11-27T17:00:00Z,One of my favorite Black Friday traditions is scrolling through GameStop on my phone and getting a bunch of cool games for cheap. Usually it works out just fine. Last weekend it was a nightmare. Its … [+5797 chars],N/A,N/A,
,,,Ridley Scott’s Napoleon: Accidentally a Comedy?,,,,,,N/A,N/A,
,/FILM,staff@slashfilm.com (Jeremy Mathai),"Dive Into The New Trailer For Night Swim, The Horror Movie About An Evil Swimming Pool","The trailer for Universal/Blumhouse&amp;#39;s new horror movie, Night Swim, features an evil force lurking in the seemingly idyllic depths of a family&amp;#39;s swimming pool.",https://www.slashfilm.com/1458070/night-swim-trailer-horror-movie-evil-swimming-pool/,https://www.slashfilm.com/img/gallery/dive-into-the-new-trailer-for-night-swim-the-horror-movie-about-an-evil-swimming-pool/l-intro-1701276906.jpg,2023-11-29T16:59:33Z,"Well, it's safe to say you'll never catch me playing Marco Polo ever again. ""Night Swim"" comes from writer and director Bryce McGuire and is based on the filmmaker's own 2014 short film, telling the … [+1489 chars]",N/A,Production,
,Bloody Disgusting,John Squires,‘Cemetery Man’ – Rupert Everett Reflects as Severin Brings the 1990s Horror Movie to 4K Ultra HD [Video],"Now available as part of the company’s Black Friday Sale, Michele Soavi‘s Cemetery Man (aka Dellamorte Dellamore) makes its 4K Ultra HD debut courtesy of Severin Films. It’s been called “stylish and gruesome” (Washington Post), “grotesque and touching” (AV Cl…",https://bloody-disgusting.com/home-video/3789961/cemetery-man-rupert-everett-reflects-as-severin-brings-the-1990s-horror-movie-to-4k-ultra-hd-video/,https://i0.wp.com/bloody-disgusting.com/wp-content/uploads/2023/11/dellam.jpg?resize=1000%2C600&ssl=1,2023-11-27T14:25:30Z,"Shattering all-time records at the box-office, Blumhouses Five Nights at Freddy’s, the haunting new horror film based on the video game series created by Scott Cawthon, will be available with never-b… [+2148 chars]",N/A,Production,
,Slickdeals.net,SlickDealio,Atom Tickets: The Hunger Games: The Ballad of Songbirds & Snakes Movie Tickets B1G1 Free,"Atom Tickets is offering Buy 1 Get 1 Free Movie Tickets for The Hunger Games: The Ballad of Songbirds & Snakes w/ promo code QUEUE applied at checkout.Note, add a quantity of 2 movie tickets to ca ...",https://slickdeals.net/f/17032360-atom-tickets-the-hunger-games-the-ballad-of-songbirds-snakes-movie-tickets-b1g1-free,https://static.slickdealscdn.com/attachment/2/2/0/5/3/14461729.attach,2023-11-13T20:50:59Z,"Are you sure you want to report this deal as expired? This will send the deal to our moderators for review. 
 If you'd like to report this thread for another reason (spam, repost, etc.) please use t… [+17 chars]",N/A,N/A,
,Gofugyourself.com,Jessica,Hunter Schafer Continues to Absolutely Nail This Hunger Games Promo Tour,"It's been so fun.
The post Hunter Schafer Continues to Absolutely Nail This Hunger Games Promo Tour first appeared on Go Fug Yourself.",https://www.gofugyourself.com/hunter-schafer-continues-to-absolutely-nail-this-hunger-games-promo-tour-11-2023,https://static.gofugyourself.com/uploads/2023/11/GettyImages-1786605077-1700186270.jpg,2023-11-17T19:06:28Z,"Listen, I personally suspect this Hunger Games iteration is going to sink like a stone because I just don’t think people are dialed into that franchise anymore — but who knows? I’ve been wrong about … [+491 chars]",N/A,N/A,
,Gofugyourself.com,Jessica,“The Hunger Games: The Ballad Of Songbirds & Snakes” Makes It To New York,"Hnter Schafer continues to kill this.
The post “The Hunger Games: The Ballad Of Songbirds & Snakes” Makes It To New York first appeared on Go Fug Yourself.",https://www.gofugyourself.com/the-hunger-games-the-ballad-of-songbirds-snakes-makes-it-to-new-york-11-2023,https://static.gofugyourself.com/uploads/2023/11/GettyImages-1795638811-1700097915.jpg,2023-11-16T18:12:10Z,"This is the post where I congratulate everyone’s stylists for getting to flaunt their skills again. These premieres have been turning out so well! Post-strike group hug!!
[Photos: Dia Dipasupil/Gett… [+8 chars]",N/A,N/A,
,/FILM,staff@slashfilm.com (Hannah Shaw-Williams),Ridley Scott's Napoleon Conquered The World Over Thanksgiving (At The Box Office),"Napoleon grossed $78.8 million worldwide over the Thanksgiving holiday, ranking in first place thanks to a strong overseas performance.",https://www.slashfilm.com/1455897/napoleon-ridley-scott-worldwide-box-office-thanksgiving/,https://www.slashfilm.com/img/gallery/ridley-scotts-napoleon-conquered-the-world-over-thanksgiving-at-the-box-office/l-intro-1701107195.jpg,2023-11-27T20:00:41Z,"Ridley Scott's latest historical tale is already off to a much better start than ""The Last Duel."" In fact, ""Napoleon"" conquered the worldwide box office over Thanksgiving, and while it came in second… [+1106 chars]",Napoleon,Box Office,
,Deadline,anthonypauldalessandro,Apple’s ‘Napoleon’ Sets Thanksgiving Global Box Office Battle Plan Via Sony With $46M WW Start – Preview,"EXCLUSIVE: Getting a leg-up here on our Thanksgiving stretch preview, Apple Studios production of Ridley Scott’s Napoleon will invade the global box office via Sony this Wednesday, in what’s shaping up to be a $46M WW global start. Split up for the Wednesday-…",https://deadline.com/2023/11/napoleon-global-box-office-opening-projection-1235617741/,https://deadline.com/wp-content/uploads/2023/11/NAPO_Feature_AM_10421_2000x1125_thumbnail.jpg?w=1024,2023-11-18T01:53:37Z,"EXCLUSIVE: Getting a leg-up here on our Thanksgiving stretch preview, Apple Studios production of Ridley Scott’s Napoleonwill invade the global box office via Sony this Wednesday, in what’s shaping u… [+2635 chars]",Napoleon,Box Office,
,AppleInsider,news@appleinsider.com (William Gallagher),"'Napoleon' is a hit with the box office, but not so much with critics","Ridley Scott and David Scarpa's ""Napoleon"" for Apple TV+ has been praised as a masterpiece and mocked as a joke, but its early Thanksgiving opening saw it beat ""Killers of the Flower Moon"" at the box office.Image Credit: Apple""Napoleon"" has just begun its the…",https://appleinsider.com/articles/23/11/22/napoleon-is-a-hit-with-the-box-office-but-not-so-much-with-critics,https://photos5.appleinsider.com/gallery/53795-108191-040323_Ridley_Scott_Napoleon_Released_Worldwide_Big_Image_01_big_image_postjpglarge_2x-xl.jpg,2023-11-22T16:59:40Z,"Image Credit: Apple
Ridley Scott and David Scarpa's ""Napoleon"" for Apple TV+ has been praised as a masterpiece and mocked as a joke, but its early Thanksgiving opening saw it beat ""Killers of the Fl… [+2371 chars]",Napoleon,Box Office,
,Deadline,anthonypauldalessandro,‘Wish’ To Rise Disney Animation’s Star Over Thanksgiving With $75M Global Opening; ‘Napoleon’ Charges For $46M WW – Box Office Preview,"Disney original animation is looking at a comeback this Thanksgiving with the princess pic Wish with as much as $45M-$50M over 5-days after suffering a setback over last year’s holiday with Strangeworld which did $18.8M. With the strikes over, and Thanksgivin…",https://deadline.com/2023/11/wish-napoleon-box-office-thanksgiving-projection-1235630318/,https://deadline.com/wp-content/uploads/2023/11/Wish-Napoleon.jpg?w=1024,2023-11-20T23:31:46Z,Disney original animation is looking at a comeback this Thanksgiving with the princess pic Wishwith as much as $45M-$50M over 5-days after suffering a setback over last year’s holiday with Strangewor… [+4215 chars],Napoleon,Box Office,
,/FILM,staff@slashfilm.com (Ryan Scott),Can Apple's Napoleon Bring Ridley Scott And Joaquin Phoenix Box Office Glory?,Can Ridley Scott&amp;#39;s Napoleon conquer the box office when it opens over the Thanksgiving holiday? Or will it suffer an epic defeat?,https://www.slashfilm.com/1449948/can-napoleon-bring-ridley-scott-and-joaquin-phoenix-box-office-glory/,https://www.slashfilm.com/img/gallery/can-apples-napoleon-bring-ridley-scott-and-joaquin-phoenix-box-office-glory/l-intro-1700251273.jpg,2023-11-19T15:00:14Z,"Apple is, first and foremost, a tech company that is worth billions and billions. Apple TV+ is a small part of the company's overall equation. Similar to Amazon with Prime Video, the company doesn't … [+1734 chars]",Napoleon,Box Office,
,ComingSoon.net,Vansh Mehra,Napoleon Box Office Prediction: Will It Flop or Succeed?,"Joaquin Phoenix’s Napoleon hits the theaters soon, and fans wish to find out how it will perform at the box office. Will the latest Apple TV movie flop, or will it succeed? Here’s a prediction based on the current projections. How Much Money is Napoleon predi…",https://www.comingsoon.net/guides/news/1408312-napoleon-box-office-prediction-flop-succeed-apple-tv,"https://www.comingsoon.net/wp-content/uploads/sites/3/2023/11/Napoleon-Box-Office-Prediction.jpg?resize=1200,630",2023-11-20T17:07:05Z,"Joaquin Phoenixs Napoleon hits the theaters soon, and fans wish to find out how it will perform at the box office. Will the latest Apple TV movie flop, or will it succeed? Heres a prediction based on… [+1855 chars]",Napoleon,Box Office,
,Screen Rant,Monica Coman,"November 2023 Box Office Breakdown: 11 Biggest Stats, Records & Failures","The November 2023 box office featured some underwhelming results, yet some movies exceeded expectations and some hit very important milestones.",https://screenrant.com/november-2023-box-office-breakdown-records-stats/,https://static1.srcdn.com/wordpress/wp-content/uploads/2023/11/november-2023-box-office-breakdown-11-biggest-stats-records-failures.jpg,2023-11-30T17:00:17Z,"Summary
<ul><li> Napoleon exceeded expectations and broke director Ridley Scott's 13-year opening curse with a global opening weekend total of $78.8 million. </li><li> Disney's animated movie Wish f… [+9246 chars]",Napoleon,Cast,
,IndieWire,Kate Erbland,"Vanessa Kirby Knows ‘Napoleon’ Is Funny, but That’s Only Part of the ‘Extreme’ World She Needed to Inhabit","The British actress steals the show in Ridley Scott's unhinged epic, and as she tells IndieWire, it's all part of her journey toward embracing what really excites her: the anti-hero.",https://www.indiewire.com/awards/consider-this/vanessa-kirby-napoleon-interview-1234930201/,https://www.indiewire.com/wp-content/uploads/2023/11/GettyImages-1793526104.jpg,2023-11-29T20:30:00Z,"[Editor’s note: The following interview contains some spoilers for Ridley Scott’s “Napoleon” — and the factual events on which it is based.]
“Napoleon” star Vanessa Kirby— cast in Ridley Scott’s spr… [+12462 chars]",Napoleon,Cast,
,The A.V. Club,Matthew Jackson,"Every Ridley Scott movie ranked, including Napoleon","It’s been nearly five decades since Ridley Scott’s first feature film, The Duellists, hit theaters, and now, even well into his 80s, the legendary filmmaker shows no signs of slowing. Napoleon, his latest feature, is as grand and intense as anything else in h…",https://www.avclub.com/every-ridley-scott-movie-ranked-including-napoleon-1851029272,"https://i.kinja-img.com/image/upload/c_fill,h_675,pg_1,q_80,w_1200/9f2e5e7b6e73bd0a60b06ea8a32108e4.jpg",2023-11-22T13:00:00Z,"Its been nearly five decades since Ridley Scotts first feature film, The Duellists, hit theaters, and now, even well into his 80s, the legendary filmmaker shows no signs of slowing. Napoleon, his lat… [+18318 chars]",Napoleon,Cast,
,The A.V. Club,Matt Schimkowitz,"Bill & Ted's Napoleon reflects on ice cream, water slides, and learning French","Joaquin Phoenix may be the latest actor to play Napoleon Bonaparte, but he certainly isn’t the first (nor will he be the last). Of all the people who’ve played the French emperor, from Marlon Brando to Verne Troyer, one looms large in our collective memories:…",https://www.avclub.com/bill-teds-napoleon-terry-camilleri-interview-1851034933,"https://i.kinja-img.com/image/upload/c_fill,h_675,pg_1,q_80,w_1200/506efd0843bebe149e51f3414c51d70a.jpg",2023-11-23T13:00:00Z,"Joaquin Phoenix may be the latest actor to play Napoleon Bonaparte, but he certainly isnt the first (nor will he be the last). Of all the people whove played the French emperor, from Marlon Brando to… [+10696 chars]",Napoleon,Cast,
,The A.V. Club,Sam Barsanti,Ridley Scott on Napoleon complaints from French critics: “the French don’t even like themselves”,"Earlier this month, as part of a New Yorker profile, Napoleon director Ridley Scott suggested that anyone pointing out historical inaccuracies in his film should “get a life” (which seems fair, if bluntly stated, because that kind of very-online anti-fun/crea…",https://www.avclub.com/ridley-scott-napoleon-french-critics-1851034530,"https://i.kinja-img.com/image/upload/c_fill,h_675,pg_1,q_80,w_1200/130c4c63ca983bcd222c8230ae1d75c0.jpg",2023-11-19T17:51:00Z,"Earlier this month, as part of a New Yorker profile, Napoleondirector Ridley Scott suggested that anyone pointing out historical inaccuracies in his film should get a life (which seems fair, if blunt… [+1907 chars]",Napoleon,Cast,
,IndieWire,Jim Hemphill,Ridley Scott’s First Napoleonic Epic Came Out 46 Years Ago — and Cost Under a Million Dollars,"As ""Napoleon"" marches across the world's movie theatres, look back at the movie that set in motion Ridley Scott's obsession with the French emperor — and his own career.",https://www.indiewire.com/features/commentary/napoleon-ridley-scott-the-duellists-1234928256/,https://www.indiewire.com/wp-content/uploads/2023/11/Duellists-1.jpg,2023-11-22T19:00:00Z,"Ridley Scott‘s wildly ambitious “Napoleon” might be the director’s last word on its subject, but it’s not the first time he tackled both the glory and the absurdity of the Napoleonic era. One could s… [+6623 chars]",Napoleon,Cast,
,IndieWire,Christian Zilko,Ridley Scott Isn’t Worried About ‘Napoleon’ Critics Because ‘the French Don’t Even Like Themselves’,"The ""Gladiator"" director continues to take every opportunity to remind the world that he doesn't care what it thinks of his latest epic.",https://www.indiewire.com/news/general-news/ridley-scott-napoleon-critics-the-french-dont-like-themselves-1234927923/,https://www.indiewire.com/wp-content/uploads/2023/11/GettyImages-1797059327.jpg,2023-11-19T20:03:50Z,Ridley Scott is not a man who minces words. His press tour for his $200 million Apple epic “Napoleon” has already seen the 85-year-old filmmaker proclaiming that it’s “about feckin’ time” he won an O… [+1917 chars],Napoleon,Cast,
,The New Yorker,Adam Gopnik,The French Are Not Happy About “Napoleon”,"Adam Gopnik writes about how Ridley Scott’s 2023 film, “Napoleon,” has provoked a surreal cultural dislocation and unintended comedy among French audiences.",https://www.newyorker.com/culture/cultural-comment/the-french-are-not-happy-about-napoleon,"https://media.newyorker.com/photos/65676b64d25efd60fad1a8e3/16:9/w_1280,c_limit/Gopnik-Napoleon.jpg",2023-11-30T00:43:43Z,"Joaquin Phoenix in Ridley Scotts Napoleon.Photograph courtesy Apple TV+
Americans are so used to seeing history played by Americans that the oddity of it hardly registers anymore. Charlton Heston wa… [+4176 chars]",Napoleon,Delivery,
,HYPEBEAST,info@hypebeast.com (Hypebeast),Ridley Scott's 'Napoleon' Looking to Open With $70 Million USD,"Ridley Scott’s Napoleon is eyeing at least $70 million USD for its global opening.According to reports, the Joaquin Phoenix-led title has earned around $21 million USD as of November 23 and could debut with somewhere between $70 million USD and $73 million US…",https://hypebeast.com/2023/11/ridley-scott-joaquin-phoenix-napoleon-weekend-box-office-projections,https://image-cdn.hypb.st/https%3A%2F%2Fhypebeast.com%2Fimage%2F2023%2F11%2Ftw-ridley-scott-joaquin-phoenix-napoleon-weekend-box-office-projections.jpg?w=1080&cbr=1&q=90&fit=max,2023-11-25T09:02:22Z,"Ridley Scotts Napoleon is eyeing at least $70 million USD for its global opening.
According to reports, the Joaquin Phoenix-led title has earned around $21 million USD as of November 23 and could de… [+815 chars]",Napoleon,Delivery,
,The A.V. Club,Ian Spelling,The 20 best on-screen Napoleons,"Napoleon Bonaparte died on May 21, 1821, but the iconic French emperor has lived on (and on and on) in numerous movies and television shows. Esteemed director Ridley Scott, who dipped his l’orteils in the water with 1977’s Napoleonic War drama The Duellists, …",https://www.avclub.com/best-napoleon-actors-film-tv-1851042411,"https://i.kinja-img.com/image/upload/c_fill,h_675,pg_1,q_80,w_1200/4f3603ddc0cbc9d51d293cae54837cc1.jpg",2023-11-24T13:00:00Z,"Who played Napoleon: Pierre Mondy
So big, so sprawling, so long and so expensive was Abel Gances 1927 Napoleon that heat the timedid not achieve his dream of telling the emperors entire story. Decad… [+535 chars]",Napoleon,Delivery,
,/FILM,staff@slashfilm.com (Witney Seibold),Did Josephine Actually Love Napoleon? Ridley Scott Has Thoughts,Were Napoleon Bonaparte (played by Joaquin Phoenix) and Jos&eacute;phine de Beauharnais (played by Vanessa Kirby) really in love? Ridley Scott has thoughts.,https://www.slashfilm.com/1447928/did-josephine-love-napoleon-ridley-scott-has-thoughts/,https://www.slashfilm.com/img/gallery/did-josephine-actually-love-napoleon-ridley-scott-has-thoughts/l-intro-1700079025.jpg,2023-11-22T21:00:00Z,"In Ridley Scott's new historical biopic ""Napoleon,"" the relationship between Napoleon Bonaparte (Joaquin Phoenix) and Joséphine de Beauharnais (Vanessa Kirby) is depicted as refreshingly direct and e… [+1454 chars]",Napoleon,Delivery,
,The A.V. Club,The A.V. Club Bot,"The week in film: Ridley Scott's movies ranked, Best Actress contenders revealed","It’s been nearly five decades since Ridley Scott’s first feature film, The Duellists, hit theaters, and now, even well into his 80s, the legendary filmmaker shows no signs of slowing. Napoleon, his latest feature, is as grand and intense as anything else in h…",https://www.avclub.com/the-week-in-film-ridley-scotts-movies-ranked-best-act-1851046379,"https://i.kinja-img.com/image/upload/c_fill,h_675,pg_1,q_80,w_1200/762186a0d72a4f1d91301dfe1da88ee0.jpg",2023-11-26T16:40:00Z,"Its been nearly five decades since Ridley Scotts first feature film, The Duellists, hit theaters, and now, even well into his 80s, the legendary filmmaker shows no signs of slowing. Napoleon, his lat… [+5764 chars]",Napoleon,Directing,
,/FILM,staff@slashfilm.com (Michael Boyle),"Napoleon's Last Stand And The Battle Of Waterloo, Explained","The Battle of Waterloo is one of the most important conflicts in history, but the movie Napoleon barely explains what the heck is going on.",https://www.slashfilm.com/1456019/napoleons-last-stand-battle-of-waterloo-explained/,https://www.slashfilm.com/img/gallery/napoleons-last-stand-and-the-battle-of-waterloo-explained/l-intro-1701111632.jpg,2023-11-28T18:00:23Z,"In the end, Waterloo was the second deadliest battle in the Napoleonic Wars. ""Between 25,000 to 31,000 Frenchmen were killed or wounded,"" Roberts writes, whereas there were over 24,000 casualties on … [+1470 chars]",Napoleon,Lore,
,Vox,Nylah Burton,"The truth about Napoleon and Josephine’s marriage, divorce, and lasting legacy","Napoleon’s marriage to and divorce from Empress Josephine, not quite explained by Ridley Scott’s new movie.",https://www.vox.com/2023/11/30/23981269/napoleon-josephine-marriage-divorce-ridley-scott-bonaparte-history-true-story,https://cdn.vox-cdn.com/thumbor/oGT4RblJKVjbKhRJ-OzFcoapoyQ=/0x21:1280x691/fit-in/1200x630/cdn.vox-cdn.com/uploads/chorus_asset/file/25120369/img2.jpg,2023-11-30T12:30:00Z,"What viewers might want or expect from Ridley Scotts Napoleon epic scenes of war, sexily torn bodices, and a very short emperor wont be exactly what they get. The battle scenes drag on, the ruler is … [+16036 chars]",Napoleon,Lore,
,GQ Magazine,Jack King,"Every question we had about the horses in Napoleon, answered","Move, over, Ken: there's a new horse guy in town. GQ speaks to the horsemasters of Ridley Scott's historical epic, who assembled over 100 equines for the most striking battle scenes in recent horsey memory.",https://www.gq.com/story/how-napoleon-assembled-an-all-star-cast-of-horse-actors-for-austerlitz,"https://media.gq.com/photos/65664729f12a08f92d70cc83/16:9/w_1280,c_limit/Napoleon_horses_HP_0002_M230928_SP007-2.jpg",2023-11-28T20:42:01Z,"The Naprous' played a role in every equine element of Napoleon's production, from ensuring that the tack, harnesses and saddles used were period-appropriate, to choreo and performance training. Our c… [+2414 chars]",Napoleon,Lore,
,Forbes,"Zenger News, Contributor, 
 Zenger News, Contributor
 https://www.forbes.com/sites/zengernews/",Descendant Of Napoleon Sounds Off Film’s Portrays His Leadership,A descendant of Napoleon offers this take on the new film's portrayal of the famous French leader,https://www.forbes.com/sites/zengernews/2023/11/28/descendant-of-napoleon-sounds-off-films-portrays-his-leadership/,https://imageio.forbes.com/specials-images/imageserve/6564cb4a9ed3b74fed081bfa/0x0.jpg?format=jpg&height=900&width=1600&fit=bounds,2023-11-28T08:30:57Z,"Prince Imperial Joachim Murat sits for a portrait photo, an image of his famous ancestor sits behind ... [+] him. Murat is related to Napoleon, the famous French emperor is the subject of a new major… [+6035 chars]",Napoleon,Lore,
time,Time,David A. Bell,Why We’re Still So Obsessed With Napoleon,"David A. Bell explores the many sides of Napoleon, and how his story should remind us of the darkness that humans are capable of—not just the grand adventures.",https://time.com/6337581/napoleon-obsession-essay/,https://api.time.com/wp-content/uploads/2023/11/Napoleon-Revolutionary-War-Italy-1796.jpg?quality=85,2023-11-22T12:00:00Z,"On December 2, 1804, Napoleon Bonaparte was preparing to crown himself Emperor of the French in Notre Dame Cathedral. The pope had arrived to bless the ceremony. Hundreds of musicians were playing hy… [+6825 chars]",Napoleon,Lore,
,The Atlantic,David Sims,An Enjoyable Extravaganza About … Napoleon?,Ridley Scott’s take on the French leader is a sample platter of big battles and bristling insecurities.,https://www.theatlantic.com/culture/archive/2023/11/napoleon-movie-review/676082/?utm_source=feed,,2023-11-22T13:00:00Z,"When it comes to battle tactics, Napoleon Bonaparte (as played by Joaquin Phoenix) is very gun forward. There are few conflicts he marches into that don’t involve the firing of many cannons, an insti… [+4851 chars]",Napoleon,Lore,
,/FILM,staff@slashfilm.com (Jacob Hall),The Book You Should Read If You Love – Or Hate – Ridley Scott's Napoleon,"Ridley Scott&amp;#39;s Napoleon isn&amp;#39;t historically accurate, which wouldn&amp;#39;t be a problem if if was as interesting as actual history.",https://www.slashfilm.com/1453102/book-you-should-read-if-you-love-or-hate-ridley-scotts-napoleon/,https://www.slashfilm.com/img/gallery/the-book-you-should-read-if-you-love-or-hate-ridley-scotts-napoleon/l-intro-1700633030.jpg,2023-11-22T16:27:00Z,Here's the thing: I don't care that Scott throws history to the wind for the film's battle scenes and leans into myth making and striking images. How the heck do you dramatize military corps organiza… [+2523 chars],Napoleon,Lore,
,/FILM,staff@slashfilm.com (Rafael Motamayor),"One Of The Most Striking Moments In Napoleon Kind Of Happened, But Not Really","Did The Battle of Austerlitz happen the way it is depicted in Ridley Scott&amp;#39;s new epic Napoleon? Well, not exactly.",https://www.slashfilm.com/1452618/one-of-the-most-striking-moments-in-napoleon-kind-of-happened/,https://www.slashfilm.com/img/gallery/one-of-the-most-striking-moments-in-napoleon-kind-of-happened-but-not-really/l-intro-1700595161.jpg,2023-11-23T16:00:13Z,"Sure, it'd be easy to criticize ""Napoleon"" for its historical inaccuracies, but the truth is that Napoleon's mind for logistics and organization isn't very cinematic. Besides, the sight of an army fa… [+1439 chars]",Napoleon,Lore,
,The Intercept,Deconstructed,"Who Was Napoleon’s Wife, Joséphine Bonaparte?","With “Napoleon” coming to theaters, we visit the fascinating life of his first wife, Josephine Bonaparte.
The post Who Was Napoleon’s Wife, Joséphine Bonaparte? appeared first on The Intercept.",http://theintercept.com/2023/11/19/deconstructed-podcast-josephine-bonaparte-napoloeon/,https://theintercept.com/wp-content/uploads/2023/11/deconstructed-josephine-bonaparte-ft.jpg?fit=1440%2C720&w=1200&h=800,2023-11-19T21:30:00Z,"This week, theaters around the country will begin to screen Napoleon, a historical drama film based on the story of Napoleon Bonaparte. The film, starring Joaquin Phoenix in the titular role, chronic… [+581 chars]",Napoleon,Lore,
