Source ID,Source Name,Author,Title,Description,URL,URL To Image,Published At,Content,Film,Aspect,
,Gizmodo.com,Sabina Graves,Destin Daniel Cretton Departs Marvel's Avengers: The Kang Dynasty,"Photo: Frazer Harrison (Getty Images)
With so many things in flux at Marvel Studios, there’s news from that Shang-Chi And the Legend of the The Ten Rings director Destin Daniel Cretton has departed the director’s chair of Marvel Studios’ Avengers: The Kang D…",https://gizmodo.com/destin-daniel-cretton-departs-avengers-the-kang-dynasty-1851025565,"https://i.kinja-img.com/image/upload/c_fill,h_675,pg_1,q_80,w_1200/4349f645212ba55d844dff905ae090c6.jpg",2023-11-15T20:10:00Z,"With so many things in flux at Marvel Studios, theres news thatShang-Chi And the Legend of the The Ten Rings director Destin Daniel Cretton has departed the directors chair of Marvel Studios Avengers… [+2040 chars]",N/A,N/A,
,The A.V. Club,Scott Huver,All The Marvels Easter eggs and references explained,"For better or worse, a certain level of fluency in the ever-expanding tapestry of the Marvel Cinematic Universe is required by The Marvels. While the film—which brings together Captain Marvel’s Carol Danvers (Brie Larson), WandaVision’s Monica Rambeau (Teyona…",https://www.avclub.com/the-marvels-easter-eggs-movie-explained-1851008620,"https://i.kinja-img.com/image/upload/c_fill,h_675,pg_1,q_80,w_1200/dc7b591e654f663a4b047700fc73fbb5.jpg",2023-11-13T14:00:00Z,"For better or worse, a certain level of fluency in the ever-expanding tapestry of the Marvel Cinematic Universe is required by The Marvels. While the filmwhich brings together Captain Marvels Carol D… [+10139 chars]",Marvels,Lore,
,Playstation.com,Kristen Zitani (she/her),Share of the Week: Marvel’s Spider-Man 2 – Miles Morales,"Last week, we asked you to share pictures of Miles Morales moving through the world of Marvel’s Spider-Man 2 using #PSshare #PSBlog. Here are this week’s highlights: calisarah1998 shares Miles shooting webs wearing the Shadow-Spider Suit FrameCaptureVP shares…",https://blog.playstation.com/2023/11/17/share-of-the-week-marvels-spider-man-2-miles-morales/,https://blog.playstation.com/tachyon/2023/11/729be85af19ff18d3f089b9503afdaa23dcaada0.jpg,2023-11-17T17:00:21Z,"Last week, we asked you to share pictures of Miles Morales moving through the world of Marvels Spider-Man 2 using #PSshare #PSBlog. Here are this weeks highlights:
calisarah1998shares Miles shooting… [+849 chars]",N/A,N/A,
,/FILM,staff@slashfilm.com (William Bibbiani),There's One Thing The Marvels Does Better Than Avengers: Endgame,"Avengers: Endgame is way more financially successful than The Marvels, but at least the new film meaningfully addresses the underlying concerns of its villain.",https://www.slashfilm.com/1445835/one-thing-the-marvels-does-better-than-avengers-endgame/,https://www.slashfilm.com/img/gallery/theres-one-thing-the-marvels-does-better-than-avengers-endgame/l-intro-1699914793.jpg,2023-11-14T13:00:14Z,"This post contains spoilers for ""The Marvels.""
In ""The Marvels,"" Captain Marvel, Ms. Marvel, and Monica Rambeau (the latter of whom, we will, in accordance with Kamala Khan, henceforth call ""Profess… [+1279 chars]",Marvels,Writing,
,Forbes,"Paul Tassi, Senior Contributor, 
 Paul Tassi, Senior Contributor
 https://www.forbes.com/sites/paultassi/","The Ballad Of Songbirds And Snakes: Lowest ‘Hunter Games’ Critic Score, Highest Audience Score","While the overall performance of the Hunter Games prequel, The Ballad of Songbirds and Snakes, has yet to fully play out, two things seem to be pretty clear. Critics are not overly enamored with it, while audiences seem to really love it.",https://www.forbes.com/sites/paultassi/2023/11/18/the-ballad-of-songbirds-and-snakes-lowest-hunter-games-critic-score-highest-audience-score/,https://imageio.forbes.com/specials-images/imageserve/6558d4827398f2cf68426d01/0x0.jpg?format=jpg&height=900&width=1600&fit=bounds,2023-11-18T15:16:01Z,"The Ballad of Songbirds and snakes
Lionsgate
While the overall performance of the Hunter Games prequel, The Ballad of Songbirds and Snakes, has yet to fully play out, two things seem to be pretty c… [+2467 chars]",Hunger Games,Box Office,
,/FILM,staff@slashfilm.com (Witney Seibold),The Marvels Star Iman Vellani Made An Adorable 'Mortal Enemy' On Set [Exclusive],"Iman Vellani plays the superhero Ms. Marvel in The Marvels, but her real arch-nemesis is one of her adorable co-stars.",https://www.slashfilm.com/1447093/the-marvels-star-iman-vellani-adorable-mortal-enemy-exclusive/,https://www.slashfilm.com/img/gallery/the-marvels-star-iman-vellani-made-an-adorable-mortal-enemy-on-set-exclusive/l-intro-1700051821.jpg,2023-11-15T22:00:00Z,"But, first, yes, those were real kittens on set, and, yes, they were indeed distracting to their bipedal counterparts. Vellani even recalled that actor Mohan Kapur, who plays Kamala's dad, Yusuf, was… [+1437 chars]",Marvels,Delivery,
,/FILM,staff@slashfilm.com (Ryan Scott),The Marvels Box Office Was Even Worse Than Expected – What The Heck Happened?,"The Marvels, the latest film in the ongoing Marvel Cinematic Universe, significantly stumbled in its opening weekend, marking the worst MCU opening ever.",https://www.slashfilm.com/1445357/the-marvels-box-office-worse-than-expected-what-happened/,https://www.slashfilm.com/img/gallery/the-marvels-box-office-was-even-worse-than-expected-what-the-heck-happened/l-intro-1699896175.jpg,2023-11-13T18:00:13Z,"It should have been a big weekend at the box office as ""The Marvels,"" the latest entry in the Marvel Cinematic Universe, arrived in theaters. This wasn't just any entry in the multi-billion-dollar fr… [+1493 chars]",Marvels,Box Office,
,/FILM,staff@slashfilm.com (Jenna Busch),The Marvels' Young Avengers Tease Originally Featured More Characters [Exclusive],The Marvels star Iman Vellani has confirmed that she shot a different version of the film&amp;#39;s Young Avengers tease than the one that made the theatrical cut.,https://www.slashfilm.com/1446963/the-marvels-young-avengers-tease-originally-featured-more-characters/,https://www.slashfilm.com/img/gallery/the-marvels-young-avengers-tease-originally-featured-more-characters-exclusive/l-intro-1700051741.jpg,2023-11-15T13:45:30Z,We may end up getting to see the banter between Kate Bishop and Kamala Khan in the film's home media release or a Disney+ special. Considering these two are my absolute favorites of the Young Avenger… [+1201 chars],Marvels,Cast,
,/FILM,staff@slashfilm.com (BJ Colangelo),The Marvels Mid-Credits Scene Gave Iman Vellani A 'Heart Attack' [Exclusive],"The Marvels star Iman Vellani is a fan of the MCU, so when she saw the mid-credits scene of her movie, she fangirled out for real.",https://www.slashfilm.com/1447117/the-marvels-mid-credits-scene-iman-vellani-heart-attack-exclusive/,https://www.slashfilm.com/img/gallery/the-marvels-mid-credits-scene-gave-iman-vellani-a-heart-attack-exclusive/l-intro-1700007340.jpg,2023-11-15T12:00:00Z,"""I read the script, but they wrote a different name,"" she tells Anderton. ""It wasn't Beast, so I didn't know they were filming that."" Vellani didn't tell Anderton who the different name was. Still, i… [+1347 chars]",Marvels,Writing,
,/FILM,staff@slashfilm.com (Ethan Anderton),"The Marvels Star Iman Vellani Talks Working With Kittens, Young Avengers & More [Exclusive Interview]","We spoke with The Marvels star Iman Vellani about working with kittens, teasing the Young Avengers, deleted scenes, and who her own personal Captain Marvel is.",https://www.slashfilm.com/1446432/the-marvels-iman-vellani-interview-kittens-young-avengers-credits-scene/,https://www.slashfilm.com/img/gallery/the-marvels-star-iman-vellani-talks-working-with-kittens-young-avengers-more-exclusive-interview/l-intro-1699981867.jpg,2023-11-14T18:00:31Z,"I have to say, I'm so glad that the actors' strike ended and you were able to talk about this movie. Because after seeing how great you were in it, I was just like, ""Man, it would be a total bummer i… [+3204 chars]",Marvels,Cast,
,Deadline,Katie Campione,Josh Andrés Rivera On The “Challenge” Of Playing Aaron Hernandez In ‘American Sports Story’,Josh Andrés Hernandez is preparing to dig into the mind of Aaron Hernandez for his upcoming role in Ryan Murphy’s American Sports Story. The actor spoke with Deadline about preparing to portray the troubled former Patriots tight end at Monday’s Los Angeles pr…,https://deadline.com/2023/11/josh-andres-rivera-cast-aaron-hernandez-american-sports-story-interview-1235611768/,https://deadline.com/wp-content/uploads/2023/11/GettyImages-1792538000.jpg?w=1000,2023-11-14T18:00:00Z,"Josh Andrés Hernandez is preparing to dig into the mind of Aaron Hernandez for his upcoming role in Ryan Murphy‘s American Sports Story. 
The actor spoke with Deadline about preparing to portray the… [+1629 chars]",N/A,N/A,
,/FILM,staff@slashfilm.com (Witney Seibold),"The Marvels Musical Planet Scene Was Originally Longer, And Iman Vellani Loved It [Exclusive]",Iman Vellani loved filming the musical sequence on Aladna in The Marvels but was disappointed to see how much of it was left out of the theatrical cut.,https://www.slashfilm.com/1446867/the-marvels-musical-planet-scene-longer-iman-vellani-loved-it/,https://www.slashfilm.com/img/gallery/the-marvels-musical-planet-scene-was-originally-longer-and-iman-vellani-loved-it-exclusive/l-intro-1699995259.jpg,2023-11-14T22:00:55Z,"When asked about the cut and/or reshot scenes for ""The Marvels,"" Vellani was forthcoming, saying:
""There's a longer version of the Aladna dance. I am a musical theater nerd, and I loved it. They sen… [+1523 chars]",Marvels,Production,
,/FILM,staff@slashfilm.com (Jeremy Smith),Where Does Iman Vellani Think Marvel Can Improve? Start With The Fandom [Exclusive],The Marvels star Iman Vellani has faith in the Marvel Cinematic Universe. If only the fans would &amp;#39;let them cook.&amp;#39;,https://www.slashfilm.com/1447086/iman-vellani-marvel-fans-must-improve/,https://www.slashfilm.com/img/gallery/where-does-iman-vellani-think-marvel-can-improve-start-with-the-fandom-exclusive/l-intro-1700004980.jpg,2023-11-15T19:00:00Z,"It's a shame that Nia DaCosta's ""The Marvels"" failed to draw in mainstream moviegoers because, despite the film's flaws, they're missing out on a star-making performance from Iman Vellani, who steals… [+1257 chars]",Marvels,Cast,
,IndieWire,Brian Welk,Does Marvel Have a Gen-Z Problem? Just 19% of ‘The Marvels’ Audience Was 18-24,"Just 19 percent of ""The Marvels"" audience was 18-24; compare that to 40 percent for ""Captain Marvel.""",https://www.indiewire.com/news/business/marvel-gen-z-problem-viewers-age-18-24-1234925056/,https://www.indiewire.com/wp-content/uploads/2022/06/JER-102-05569_R.jpg,2023-11-14T20:00:00Z,"Matt Ramos, 22, was just 7 years old when the original “Iron Man” hit theaters. He was not the target audience for the film; nor was his Gen-Z responsible for making Marvel and the MCU a cultural and… [+9111 chars]",Marvels,Production,
,IndieWire,Samantha Bergeson,Hunter Schafer Was ‘Mind-Blown’ Filming David Lowery’s ‘Mother Mary’,"Anne Hathaway stars as a pop singer who gets tangled up with a fashion designer, played by Michaela Coel.",https://www.indiewire.com/news/general-news/hunter-schafer-teases-david-lowery-mother-mary-mind-blown-1234927045/,https://www.indiewire.com/wp-content/uploads/2023/11/GettyImages-1784430876.jpg,2023-11-16T21:00:00Z,"Hunter Schafer reached a euphoric state while filming the upcoming music-centric feature “Mother Mary.” 
The “Euphoria” breakout star has a supporting role in David Lowery‘s upcoming drama, which fo… [+2008 chars]",N/A,N/A,
,The A.V. Club,William Hughes,Avengers: The Kang Dynasty loses its director,"As far as big cinematic tentpoles go, few look as wobbly, at least from the outside, as Marvel’s upcoming plans for 2025 and beyond’s “Phase Six.” Parent studio Disney has already been doing a bunch of schedule shifting this month, bumping lots of movies back…",https://www.avclub.com/avengers-kang-dynasty-destin-daniel-cretton-leaves-dire-1851026415,"https://i.kinja-img.com/image/upload/c_fill,h_675,pg_1,q_80,w_1200/1edeb2f8d2186130b7ccae0a2b72481f.jpg",2023-11-15T23:49:00Z,"As far as big cinematic tentpoles go, few look as wobbly, at least from the outside, as Marvels upcoming plans for 2025 and beyonds Phase Six. Parent studio Disney has already been doing a bunch of s… [+1551 chars]",N/A,N/A,
,/FILM,staff@slashfilm.com (Sandy Schaefer),"Don't Feed The Trolls, And Don't Blame The Marvels Director Nia DaCosta For The Film's Box Office","Crappy people online are throwing The Marvels director Nia DaCosta under the bus for the film&amp;#39;s disappointing box office, but that&amp;#39;s objectively inaccurate.",https://www.slashfilm.com/1445413/dont-blame-the-marvels-director-nia-dacosta-for-box-office/,https://www.slashfilm.com/img/gallery/dont-feed-the-trolls-and-dont-blame-the-marvels-director-nia-dacosta-for-the-films-box-office/l-intro-1699898568.jpg,2023-11-13T20:00:26Z,"What a difference five years can make. This time back in 2018, Marvel Studios was on a red hot streak and was gearing up for the release of ""Captain Marvel,"" another sure-to-be box office gem to add … [+1592 chars]",Marvels,Box Office,
,Gizmodo.com,Germain Lussier,Marvel's What If...? Season 2 Arrives Next Month and Here's the First Trailer,"The Watcher is back in What If season 2.
Image: Marvel Studios
What if Marvel had a holiday present for us all? Nine straight days of brand new stories set in an alternate reality to the Marvel Cinematic Universe? Well, that’s not a hypothetical. It’s actua…",https://gizmodo.com/what-if-season-2-trailer-doctor-strange-marvel-disney-1851024628,"https://i.kinja-img.com/image/upload/c_fill,h_675,pg_1,q_80,w_1200/8f45d2a0eb2556f97bf4c90dedfb9658.jpg",2023-11-15T17:30:00Z,"What if Marvel had a holiday present for us all? Nine straight days of brand new stories set in an alternate reality to the Marvel Cinematic Universe? Well, thats not a hypothetical. Its actually hap… [+1531 chars]",N/A,N/A,
,The A.V. Club,Saloni Gajjar,Dakota Johnson suits up as clairvoyant Madame Web in the movie's first trailer,"Get ready to spend Valentine’s Day with another promising female superhero team-up. On the heels of the MCU’s The Marvels, Sony has released a trailer for their upcoming Madame Web, starring Dakota Johnson. Lemons, Ellen DeGeneres, and now supervillains—she’s…",https://www.avclub.com/dakota-johnson-suits-up-as-madame-webb-in-first-trailer-1851023751,"https://i.kinja-img.com/image/upload/c_fill,h_675,pg_1,q_80,w_1200/5cca4d0d4cfbcb5e6cd2aa7a1e75dfbb.png",2023-11-15T15:02:00Z,"Get ready to spend Valentines Day with another promising female superhero team-up. On the heels of the MCUs The Marvels, Sony has released a trailer for their upcoming Madame Web, starring Dakota Joh… [+1793 chars]",Marvels,Production,
,/FILM,staff@slashfilm.com (Danielle Ryan),Ridley Scott Has A Hot Take On The 'Villain' Of Gladiator – It's Not Joaquin Phoenix,"As director Ridley Scott sees it, both Commodus and Maximus are victims of Marcus Aurelius&amp;#39; failures as a father in Gladiator.",https://www.slashfilm.com/1447879/ridley-scott-villain-of-gladiator-not-joaquin-phoenix/,https://www.slashfilm.com/img/gallery/ridley-scott-has-a-hot-take-on-the-villain-of-gladiator-its-not-joaquin-phoenix/l-intro-1700075939.jpg,2023-11-16T17:00:50Z,"One of the most memorable things about Ridley Scott's incredible Roman epic ""Gladiator"" is just how insufferable Joaquin Phoenix's character Commodus can be. He serves as a foil to Russell Crowe's Ma… [+1105 chars]",N/A,N/A,
,/FILM,staff@slashfilm.com (Ryan Scott),"The Marvels Box Office Points To A Major Problem In Hollywood, Not Just Marvel","Unfortunately for Disney (and Hollywood in general), larger budgets have become the norm of late. The Marvels is the latest example of why that&amp;#39;s a big problem.",https://www.slashfilm.com/1445692/the-marvels-box-office-major-problem-hollywood/,https://www.slashfilm.com/img/gallery/the-marvels-box-office-points-to-a-major-problem-in-hollywood-not-just-marvel/l-intro-1699908563.jpg,2023-11-13T21:00:47Z,"The pandemic not only forced Hollywood to shut down for the better part of the year, but it pushed the industry rapidly towards streaming. Disney+ launched and, with that, Marvel needed to become an … [+1793 chars]",Marvels,Production,
,The A.V. Club,"Sam Barsanti, Mary Kate Carr, Saloni Gajjar, William Hughes, and Jen Lennon",What's right and what's wrong with Marvel today?,"It’s not much of a surprise that The Marvels didn’t fare so well at the domestic box office in its first weekend. Sure, it came in at No. 1 with $47 million, but that’s the lowest opening of any film in the Marvel Cinematic Universe. Factor in the $41.4 milli…",https://www.avclub.com/state-of-the-mcu-roundtable-marvel-cinematic-universe-1851018131,"https://i.kinja-img.com/image/upload/c_fill,h_675,pg_1,q_80,w_1200/68ab21c9fbaa20d4872c0ca9c01ff0d2.jpg",2023-11-14T14:00:00Z,"Its not much of a surprise that The Marvels didnt fare so well at the domestic box office in its first weekend. Sure, it came in at No. 1 with $47 million, but thats the lowest opening of any film in… [+11537 chars]",Marvels,Box Office,
,The A.V. Club,Sam Barsanti,May the weekend box office be ever in The Ballad Of Songbirds And Snakes’ favor,"After a couple of slow weekends at the domestic box office, things have bounced back nicely thanks to four pretty big new releases that mostly did okay (and one movie with a limited rollout that did relatively good). The biggest of those big new releases is H…",https://www.avclub.com/ballad-of-songbirds-and-snakes-weekend-box-office-1851034814,"https://i.kinja-img.com/image/upload/c_fill,h_675,pg_1,q_80,w_1200/19700a7e4f9abc1bf131bcd0f0a88918.jpg",2023-11-19T22:10:00Z,"After a couple of slow weekends at the domestic box office, things have bounced back nicely thanks to four pretty big new releases that mostly did okay (and one movie with a limited rollout that did … [+1551 chars]",Hunger Games,Box Office,
,Playstation.com,Ray McCaffrey,Five Nights at Freddy’s: Help Wanted 2 seeks new employees December 14,"I’m Ray McCaffrey, executive producer from Steel Wool Studios, and I speak for our entire time when I say that we’re thrilled to finally give y’all a sneak preview of what you’ll be able to expect in Five Nights at Freddy’s: Help Wanted 2. We will cover the o…",https://blog.playstation.com/2023/11/20/five-nights-at-freddys-help-wanted-2-seeks-new-employees-december-14/,https://blog.playstation.com/tachyon/2023/11/3bcd26b84374a1adf141455184b9bb663735bba5.jpg,2023-11-20T18:01:37Z,"Im Ray McCaffrey, executive producer from Steel Wool Studios, and I speak for our entire time when I say that were thrilled to finally give yall a sneak preview of what youll be able to expect in Fiv… [+3928 chars]",Five Nights at Freddy's,Lore,
engadget,Engadget,Will Shanklin,PS5 Black Friday deals 2023: Get $50 off the PlayStation 5,"We’ve found plenty of PS5 Black Friday deals, including games, accessories, store funds and the console itself. Grab the disc-based PlayStation 5 system for $450 on Amazon or $50 off the PS5 Slim bundled with Marvel’s Spider-Man 2 or Call of Duty: Modern Warf…",https://www.engadget.com/ps5-black-friday-deals-2023-get-50-off-the-playstation-5-181606741.html,https://s.yimg.com/os/creatr-uploaded-images/2023-11/e4832d50-8ae5-11ee-adab-7ad10b7caf12,2023-11-24T18:16:06Z,"Weve found plenty of PS5 Black Friday deals, including games, accessories, store funds and the console itself. Grab the disc-based PlayStation 5 system for $450 on Amazon or $50 off the PS5 Slim bund… [+3694 chars]",N/A,N/A,
,Forbes,"Paul Tassi, Senior Contributor, 
 Paul Tassi, Senior Contributor
 https://www.forbes.com/sites/paultassi/",‘Five Nights At Freddy’s’ Has Now Outgrossed ‘The Flash’ Globally,"Five Nights at Freddy’s has now outgrossed The Flash’s worldwide box office, hitting $271 million to The Flash’s $270 million.",https://www.forbes.com/sites/paultassi/2023/11/20/five-nights-at-freddys-has-now-outgrossed-the-flash-globally/,https://imageio.forbes.com/specials-images/imageserve/65410de142b307f16e50b4c8/0x0.jpg?format=jpg&height=900&width=1600&fit=bounds,2023-11-20T13:42:07Z,"Five Nights at Freddy's
Universal
If Barbie and Oppenheimer werent enough to show you that 2023 is the generally year of the not superhero movies, perhaps this new item will change your mind. That … [+2273 chars]",Five Nights at Freddy's,Box Office,
,IndieWire,Tom Brueggemann,‘The Marvels’ Will Become the First MCU Title to Fall Short of $100 Million Domestic,"In happier box-office news, ""The Hunger Games: Ballad of Songbirds and Snakes"" opened well while ""Saltburn"" and ""Fallen Leaves"" had strong limited debuts.",https://www.indiewire.com/news/box-office/the-marvels-first-mcu-title-fall-short-100-million-1234927842/,https://www.indiewire.com/wp-content/uploads/2023/11/MCDHUGA_LG025.jpg,2023-11-19T19:05:09Z,"Franchise entries “Hunger Games: The Ballad of Songbirds and Snakes” (Lionsgate) and “Trolls Band Together” (Universal) opened to respectable levels, if below their precedents, to take #1 and #2 in t… [+7211 chars]","Marvels, Hunger Games",Box Office,
,ComingSoon.net,Maggie Dela Paz,"Five Nights at Freddy’s 4K, Blu-ray, and DVD Release Date Set for Blumhouse Movie","Universal Pictures Home Entertainment has officially set the Five Nights at Freddy’s 4K, Blu-ray, and DVD release dates for Blumhouse‘s newest horror movie, based on the popular video game franchise of the same name. The film will see a November 28 digital re…",https://www.comingsoon.net/movies/news/1410346-five-nights-at-freddys-4k-blu-ray-dvd-release,"https://www.comingsoon.net/wp-content/uploads/sites/3/2023/11/Freddy-and-his-crew-in-Five-Nights-at-Freddys-e1700599277928.jpg?resize=1200,630",2023-11-21T21:05:18Z,"Universal Pictures Home Entertainment has officially set the Five Nights at Freddys 4K, Blu-ray, and DVD release dates for Blumhouses newest horror movie, based on the popular video game franchise of… [+1921 chars]",Five Nights at Freddy's,Production,
,ComingSoon.net,Neil Bolt,Five Nights at Freddy’s Movie Digital Release Date Revealed for US and UK,"The Five Nights at Freddy’s movie digital release date has been revealed, and UK fans frustrated by a lack of at-home viewing options will not have to wait too long. Five Nights at Freddy’s Movie Digital Release Date Prime Video has the Five Nights at Freddy’…",https://www.comingsoon.net/movies/news/1409746-five-nights-at-freddys-movie-digital-release-date,"https://www.comingsoon.net/wp-content/uploads/sites/3/2023/11/five-nights-at-freddys-digital-release-date.jpg?resize=1200,630",2023-11-21T13:35:59Z,"The Five Nights at Freddys movie digital release date has been revealed, and UK fans frustrated by a lack of at-home viewing options will not have to wait too long.
Prime Video has the Five Nights a… [+1663 chars]",Five Nights at Freddy'sj,Production,
,Deadline,Justin Kroll,Matthew Lillard Signs With Verve,"Matthew Lillard has signed With Verve for representation. Lillard can currently be seen in the Universal/Blumhouse box office and streaming hit, Five Nights At Freddys’, which opened to an astounding $80 million at the domestic box office in its opening weeke…",https://deadline.com/2023/11/matthew-lillard-verve-1235633887/,https://deadline.com/wp-content/uploads/2023/11/Matthew-Lillard.jpg?w=1024,2023-11-22T18:30:00Z,"Matthew Lillard has signed With Verve for representation.
Lillard can currently be seen in the Universal/Blumhouse box office and streaming hit, Five Nights At Freddys’, which opened to an astoundin… [+1079 chars]",Five Nights at Freddy's,Production,
,/FILM,staff@slashfilm.com (Hannah Shaw-Williams),How The Ballad Of Songbirds And Snakes Makes You Root For The Bad Guy [Exclusive],"Coriolanus Snow was the over-arching villain of The Hunger Games, but The Ballad of Songbirds and Snakes reveals he&amp;#39;s no stranger to hunger himself.",https://www.slashfilm.com/1450104/hunger-games-ballad-songbirds-snakes-root-for-bad-guy/,https://www.slashfilm.com/img/gallery/how-the-ballad-of-songbirds-and-snakes-makes-you-root-for-the-bad-guy-exclusive/l-intro-1700251284.jpg,2023-11-19T16:00:41Z,"This post contains spoilers for ""The Hunger Games: The Ballad of Songbirds &amp; Snakes.""
""The Hunger Games"" prequel story ""The Ballad of Songbirds &amp; Snakes"" flips the perspective of the origina… [+1439 chars]",Hunger Games,Writing,
,/FILM,staff@slashfilm.com (Ryan Scott),The Marvels Just Had The Biggest Second Weekend Drop Ever For A Superhero Movie,"The Marvel Cinematic Universe is good and truly in trouble, with The Marvels collapsing at the box office in its second weekend.",https://www.slashfilm.com/1451537/the-marvels-biggest-second-weekend-drop-ever-superhero-movie/,https://www.slashfilm.com/img/gallery/the-marvels-just-had-the-biggest-second-weekend-drop-ever-for-a-superhero-movie/l-intro-1700507943.jpg,2023-11-20T20:00:39Z,"The situation with ""The Marvels"" has gone from bad to record-breaking levels of bad. The latest entry in the Marvel Cinematic Universe opened last weekend to a pretty underwhelming $46.1 million, whi… [+1626 chars]",Marvels,Box Office,
