Source ID,Source Name,Author,Title,Description,URL,URL To Image,Published At,Content,Film,Aspect,
,Screen Rant,Brennan Klein,The Hunger Games: The Ballad Of Songbirds & Snakes Box Office Nears Crucial Milestone Globally,"The Hunger Games: The Ballad of Songbirds and Snakes is still trailing behind previous entries, but nears an important box office milestone.",https://screenrant.com/hunger-games-ballad-songbirds-snakes-box-office-global-200-million/,https://static1.srcdn.com/wordpress/wp-content/uploads/2023/11/rachel-zegler-as-lucy-gray-baird-in-the-hunger-games-arena-in-the-hunger-games-the-ballad-of-songbirds-and-snakes.jpg,2023-11-26T19:21:24Z,"Summary
<ul><li> The Hunger Games: The Ballad of Songbirds and Snakes is nearing an important box office milestone with a global gross of $197.2 million. </li><li> The prequel movie has earned an ad… [+2784 chars]", Hunger Games,Box Office,
,Screen Rant,Adam Bentz,Hunger Games: The Ballad Of Songbirds & Snakes Passes A Major Milestone At Domestic Box Office,The Hunger Games: The Ballad of Songbirds &amp; Snakes passes a major milestone at the domestic box office despite its franchise-low opening.,https://screenrant.com/hunger-games-songbirds-snakes-box-office-milestones-new/,https://static1.srcdn.com/wordpress/wp-content/uploads/2023/05/rachel-zegler-lucy-gray-baird-the-ballad-of-songbirds-and-snakes.jpg,2023-11-29T20:23:23Z,"Summary
<ul><li> The Hunger Games prequel film, The Ballad of Songbirds &amp; Snakes, hits a major milestone at the box office. </li><li> Despite a slow opening, the film performs well in its second… [+963 chars]", Hunger Games,Box Office,
,Screen Rant,Brennan Klein,"Thanksgiving Box Office: Hunger Games Upsets Disney’s Wish To Keep Top Spot, Projections Show",The Hunger Games: The Ballad of Songbirds and Snakes dominates Disney's new animated movie Wish in the Thanksgiving weekend box office projections.,https://screenrant.com/hunger-games-ballad-songbirds-snakes-wish-movie-thanksgiving-box-office/,https://static1.srcdn.com/wordpress/wp-content/uploads/2023/11/ariana-debose-as-asha-leaning-sadly-against-a-tree-in-wish.jpg,2023-11-24T17:38:04Z,"Summary
<ul><li> The Hunger Games: The Ballad of Songbirds and Snakes has surpassed Disney's Wish at the box office, taking the No. 1 spot during the Thanksgiving weekend. </li><li> The prequel to t… [+2952 chars]", Hunger Games,Box Office,
,Screen Rant,Brady Entwistle,"Ballad Of Songbirds & Snakes: ""Hanging Tree"" Origins & Katniss Connection Explained By Hunger Games Director",The Hunger Games: The Ballad of Songbirds &amp; Snakes director explains the origins of &quot;The Hanging Tree&quot; song and its connection to Katniss Everdeen.,https://screenrant.com/hunger-games-ballad-songbirds-snakes-hanging-tree-katniss/,https://static1.srcdn.com/wordpress/wp-content/uploads/2023/10/lucy-gray-singing.jpg,2023-11-26T15:47:50Z,"Summary
<ul><li> ""The Hanging Tree"" in The Hunger Games: The Ballad of Songbirds &amp; Snakes is revealed to be written by Lucy Gray, who witnessed a hanging at The Hanging Tree. </li><li> Katniss E… [+3857 chars]", Hunger Games,Lore,
,Screen Rant,Nick Bythrow,Hunger Games Cosplayer Meticulously Recreates Lucy Gray's Colorful Songbirds & Snakes Dress,"A Hunger Games cosplayer meticulously recreates Lucy Gray's colorful dress from The Ballad of Songbirds &amp; Snakes in stunning, vibrant detail.",https://screenrant.com/hunger-games-songbirds-snakes-lucy-gray-dress-cosplay/,https://static1.srcdn.com/wordpress/wp-content/uploads/2023/11/rachel-zegler-the-hunger-games-ballad-of-songbirds-and-snakes-1.jpg,2023-11-28T17:13:29Z,"Summary
<ul><li> A cosplayer recreates Lucy Gray's rainbow dress from The Hunger Games: The Ballad of Songbirds &amp; Snakes. </li><li> The dress is an important symbol of inspiration for Lucy Gray … [+2398 chars]", Hunger Games,Lore,
,Screen Rant,Ryan Northrup,Hunger Games: The Ballad of Songbirds and Snakes Gets Brutally Honest Poster For The Bloated Prequel,"A fan-made poster for The Hunger Games: The Ballad of Songbirds of Snakes has been released, poking fun at one common criticism of the prequel.",https://screenrant.com/hunger-games-ballad-songbirds-snakes-poster-parody/,https://static1.srcdn.com/wordpress/wp-content/uploads/2023/11/rachel-zegler-the-hunger-games-ballad-of-songbirds-and-snakes.jpg,2023-11-27T19:26:52Z,"Summary
<ul><li> A mock poster for The Hunger Games: The Ballad of Songbirds and Snakes makes fun of the movie's long runtime, retitling the movie to ""Three Hour Hunger Games Prequel"". </li><li> Rev… [+3494 chars]", Hunger Games,Production,
,Screen Rant,Kayla Laguerre-Lewis,Every Rachel Zegler Song In The Hunger Games: The Ballad Of Songbirds & Snakes Ranked,Hunger Games: The Ballad of Songbirds &amp; Snakes features a strong leading performance from Rachel Zegler who sings multiple songs in the prequel film.,https://screenrant.com/hunger-games-ballad-songbirds-snakes-rachel-zegler-songs-ranked/,https://static1.srcdn.com/wordpress/wp-content/uploads/2023/11/lucy-gray-singing-1-edited.jpg,2023-11-25T13:00:15Z,"WARNING! This article contains SPOILERS for The Hunger Games: The Ballad of Songbirds &amp; Snakes.
Summary
<ul><li> Rachel Zegler's singing talent shines in The Hunger Games: The Ballad of Songbir… [+8598 chars]", Hunger Games,Delivery,
,Screen Rant,Sarah Little,Clever Hunger Games Reference Answers Major Ballad Of Songbirds & Snakes Book Question,One throwaway line in The Hunger Games: The Ballad of Songbirds &amp; Snakes confirms a popular fan theory following the release of the book.,https://screenrant.com/hunger-games-ballad-songbirds-snakes-flickerman-caesar-father/,https://static1.srcdn.com/wordpress/wp-content/uploads/2023/11/songbirdsandsnakes_easteregg_answersquestions.jpg,2023-11-27T19:15:14Z,"Summary
<ul><li> One line in The Hunger Games: The Ballad of Songbirds &amp; Snakes confirms that Lucky Flickerman is Caesar's father, settling a question unanswered in the book. </li><li> Lucky Fli… [+3055 chars]", Hunger Games,Lore,
time,Time,Moises Mendez II,The Meaning Behind “The Hanging Tree” Song in The Hunger Games Prequel,"The meaning behind the song, which features prominently in 'The Hunger Games' and 'The Ballad of Songbirds and Snakes'",https://time.com/6336331/hunger-games-hanging-tree-song-prequel/,https://api.time.com/wp-content/uploads/2023/11/hunger-games-hanging-tree-song.jpg?quality=85,2023-11-17T21:30:32Z,"Warning: This post contains spoilers for The Ballad of Songbirds and Snakes
During one of Rachel Zeglers first red carpet appearances forThe Hunger Gamesprequel The Ballad of Songbirds and Snakes, t… [+4445 chars]", Hunger Games,Writing,
,Digital Trends,Alex Welch,"The Hunger Games: The Ballad of Songbirds & Snakes’ ending, explained",Here's everything that happens at the end of The Hunger Games: The Ballad of Songbirds & Snakes.,https://www.digitaltrends.com/movies/the-hunger-games-ballad-of-songbirds-and-snakes-2023-movie-ending-explained/,https://www.digitaltrends.com/wp-content/uploads/2023/11/Coriolanus-Snow-holds-Lucy-Grays-chin-in-The-Ballad-of-Songbirds-and-Snakes.jpg?resize=1200%2C630&p=1,2023-11-16T21:25:05Z,"Murray Close / Lionsgate
Warning: This article contains spoilers for The Hunger Games: The Ballad of Songbirds &amp; Snakes (2023).
By the time young Coriolanus Snow (Tom Blyth) has committed to fl… [+6065 chars]", Hunger Games,Writing,
,Gizmodo.com,Artem Golub,The Hunger Games Director Francis Lawrence on Adapting a Prequel,The Hunger Games: The Ballad of Songbirds and Snakes director chats with io9 about the challenges of making a prequel in the film series.,https://gizmodo.com/the-hunger-games-director-francis-lawrence-on-adapting-1851030973,"https://i.kinja-img.com/image/upload/c_fill,h_675,pg_1,q_80,w_1200/cf15fb22968b16baecd58d4b6d2dc17d.jpg",2023-11-17T18:45:00Z,"The Hunger Games: The Ballad of Songbirds and Snakes director chats with io9 about the challenges of making a prequel in the film series.
We may earn a commission from links on this page.", Hunger Games,Cast,
,The Atlantic,Shirley Li,The Real Legacy of the Hunger Games Franchise,"The series succeeded not because it had a clear political philosophy, but because it understood the power of entertainment above all.",https://www.theatlantic.com/culture/archive/2023/11/hunger-games-franchise-cultural-influence/676033/?utm_source=feed,,2023-11-17T14:17:30Z,"Hollywood was never going to stop making more Hunger Games movies. Based on Suzanne Collins’s best-selling dystopian young-adult novels, the first four films released from 2012 to 2015 collectively g… [+6621 chars]", Hunger Games,Production,
,/FILM,staff@slashfilm.com (Hannah Shaw-Williams),The Hunger Games: The Ballad Of Songbirds And Snakes Flutters Into $45 Million+ Box Office Opening,"Snow lands on top at the box office this weekend, with The Hunger Games prequel The Ballad of Songbirds and Snakes debuting at No. 1.",https://www.slashfilm.com/1450380/hunger-games-ballad-songbirds-snakes-box-office-opening-weekend/,https://www.slashfilm.com/img/gallery/the-hunger-games-the-ballad-of-songbirds-and-snakes-flutters-into-45-million-box-office-opening/l-intro-1700328144.jpg,2023-11-18T17:29:01Z,"""The Hunger Games"" prequel ""The Ballad of Songbirds &amp; Snakes"" isn't the beginning of a new saga, like the fizzled-out ""Fantastic Beasts"" series was to the ""Harry Potter"" movies. Instead, it's a s… [+1621 chars]", Hunger Games,Box Office,
,GameSpot,Phil Owen,"Why Hunger Games Prequel Is A ""Completely Distinct And Fresh"" Direction For The Franchise, Producer Says","It would probably be fair to say that the Hunger Games movie franchise is producer Nina Jacobson's baby. After she was fired from her role running Buena Vista Pictures for Disney in 2006, Jacobson struck out on her own with her production company, Color Force…",https://www.gamespot.com/articles/why-hunger-games-prequel-is-a-completely-distinct-and-fresh-direction-for-the-franchise-producer-says/1100-6519241/,https://www.gamespot.com/a/uploads/screen_kubrick/1757/17577455/4221740-hungergamesballadofsongbirdsandsnakesproducerinterview.jpg,2023-11-16T18:32:00Z,"It would probably be fair to say that the Hunger Games movie franchise is producer Nina Jacobson's baby. After she was fired from her role running Buena Vista Pictures for Disney in 2006, Jacobson st… [+5061 chars]", Hunger Games,Production,
,The A.V. Club,Peter Scobel,The Hunger Games: The Ballad of Songbirds & Snakes: what to watch before the new movie,"In the latest episode of Binge Club, our experts tell you everything you need to watch ahead of the newest Hunger Games flick",https://www.avclub.com/the-hunger-games-the-ballad-of-songbirds-snakes-wha-1851022189,"https://i.kinja-img.com/image/upload/c_fill,h_675,pg_1,q_80,w_1200/09f6d1603453cec8aacb2c7a745c19dd.png",2023-11-14T21:34:54Z,"In the latest episode of Binge Club, our experts tell you everything you need to watch ahead of the newest Hunger Games flick
We may earn a commission from links on this page.", Hunger Games,Lore,
,Vox,Alex Abad-Santos,The Ballad of Songbirds & Snakes might be the best Hunger Games movie yet,The Hunger Games: The Ballad of Songbirds & Snakes finds a new wrinkle in a story we thought we knew.,https://www.vox.com/culture/2023/11/17/23965577/hunger-games-songbirds-snakes-movie-review,https://cdn.vox-cdn.com/thumbor/KOIsZPm9KZ27PuYTBtsN2NKroWc=/0x0:6000x3141/fit-in/1200x630/cdn.vox-cdn.com/uploads/chorus_asset/file/25092243/boss_unit_220920_01273_r.jpg,2023-11-17T18:15:00Z,"When Mockingjay: Part II, the last Hunger Games movie, was released in 2015, Barack Obama was president, Taylor Swifts original 1989 album was the only version in existence, and Jon Snow was maybe de… [+9578 chars]", Hunger Games,Writing,
,/FILM,staff@slashfilm.com (Jacob Hall),How The Ballad Of Songbirds And Snakes Director Made A Vital Hunger Games Prequel [Exclusive Interview],"We sat down with director Francis Lawrence to talk about the intricacies of his new Hunger Games prequel, The Ballad of Songbirds and Snakes.",https://www.slashfilm.com/1449530/hunger-games-ballad-of-songbirds-and-snakes-director-francis-lawrence-interview/,https://www.slashfilm.com/img/gallery/how-the-ballad-of-songbirds-and-snakes-director-made-a-vital-hunger-games-prequel-exclusive-interview/l-intro-1700232610.jpg,2023-11-17T16:14:35Z,"So this is clearly Panem, but decades before the original movies. The reverse engineering of what this world looks like 70 years earlier fascinates me. Can you talk about the directives you and your … [+3978 chars]", Hunger Games,Cast,
,/FILM,staff@slashfilm.com (Jeremy Mathai),What You Need To Remember From The Hunger Games To Watch The Ballad Of Songbirds And Snakes,"The Hunger Games Universe isn&amp;#39;t the most complicated extended universe in existence, but Songbirds and Snakes is best enjoyed with a little primer.",https://www.slashfilm.com/1448042/the-hunger-games-ballad-of-songbirds-and-snakes-what-you-need-to-remember/,https://www.slashfilm.com/img/gallery/what-you-need-to-remember-from-the-hunger-games-to-watch-the-ballad-of-songbirds-and-snakes/l-intro-1700083281.jpg,2023-11-16T14:00:00Z,"Every villain needs their signature, and Coriolanus Snow's symbol of choice comes loaded with meaning. Throughout the original ""The Hunger Games"" movies, we see the sinister President commonly associ… [+1552 chars]", Hunger Games,Lore,
,/FILM,staff@slashfilm.com (Michael Boyle),Hunger Games Fans Already Met Tigris Before The Ballad Of Songbirds And Snakes,The Hunger Games: The Ballad of Songbirds and Snakes promises to deepen the lore behind one fascinating character from the original films.,https://www.slashfilm.com/1438912/the-hunger-games-songbirds-and-snakes-tigris-backstory/,https://www.slashfilm.com/img/gallery/where-youve-seen-that-songbirds-and-snakes-character-before/l-intro-1700150957.jpg,2023-11-17T13:00:00Z,"Tigris's first-ever appearance is in chapter 23 of ""Mockingjay,"" where Katniss's small team of rebels needs a place to hide within the Capitol. Katniss herself is at a loss for where to go, but Cress… [+1365 chars]", Hunger Games,Lore,
,/FILM,staff@slashfilm.com (Jeremy Mathai),The Hunger Games: The Ballad Of Songbirds And Snakes Ending Explained: Snow Always Lands On Top,"The Hunger Games: The Ballad of Songbirds and Snakes may be a prequel, but the ending has much more complexity in setting up President Snow than you may think.",https://www.slashfilm.com/1447722/hunger-games-ballad-of-songbirds-and-snakes-ending-explained-snow-always-lands-on-top/,https://www.slashfilm.com/img/gallery/the-hunger-games-the-ballad-of-songbirds-and-snakes-ending-explained-snow-always-lands-on-top/l-intro-1700071047.jpg,2023-11-16T22:00:00Z,"This article contains major spoilers for ""The Hunger Games: the Ballad of Songbirds and Snakes.""
Welcome to the 10th annual Hunger Games! The methods are cruder (and crueler), the batch of unwilling… [+1677 chars]", Hunger Games,Writing,
,Deadline,anthonypauldalessandro,‘The Hunger Games: The Ballad Of Songbirds & Snakes’ Begins With Thursday Previews Around $6M – Box Office,"EXCLUSIVE: Lionsgate’s prequel The Hunger Games: The Ballad of Songbirds & Snakes is looking at a Thursday night between $5.75M-$6M after showtimes that began at 3PM. Again, these numbers aren’t from the studio and we could see a slightly different result by …",https://deadline.com/2023/11/box-office-hunger-games-songbirds-and-snakes-1235616095/,https://deadline.com/wp-content/uploads/2023/11/MCDHUGA_LG034.jpg?w=1024,2023-11-17T06:21:53Z,"EXCLUSIVE: Lionsgate‘s prequel The Hunger Games: The Ballad of Songbirds &amp; Snakesis looking at a Thursday night between $5.75M-$6M after showtimes that began at 3PM. 
Again, these numbers aren’t… [+4168 chars]", Hunger Games,Box Office,
,Deadline,anthonypauldalessandro,‘Hunger Games: Ballad Of Songbirds & Snakes’: Spotify A Key Partner In Country Music Infused Prequel,"EXCLUSIVE: Music has continually been a facet of Lionsgate’s $3 billion Hunger Games franchise going back to ditties from Taylor Swift, Coldplay and Lorde, and with today’s theatrical release of Lionsgate’s The Hunger Games: The Ballad of Songbirds & Snakes, …",https://deadline.com/2023/11/hunger-games-songbirds-and-snakes-spotify-lionsgate-1235616087/,https://deadline.com/wp-content/uploads/2023/11/MCDHUGA_LG033.jpg?w=1024,2023-11-17T17:00:00Z,"EXCLUSIVE: Music has continually been a facet of Lionsgate‘s $3 billion Hunger Games franchise going back to ditties from Taylor Swift, Coldplay and Lorde, and with today’s theatrical release of Lion… [+2458 chars]", Hunger Games,Delivery,
ign,IGN,Scott Collura,Why The Hunger Games Matters Now More Than Ever,"With the prequel movie The Ballad of Songbirds and Snakes hitting theaters, we're looking at why The Hunger Games is more relevant now than ever.",https://www.ign.com/articles/why-the-hunger-games-matters-now-more-than-ever,https://assets-prd.ignimgs.com/2023/11/17/hungergames-blogroll-1700179653585.jpg?width=1280,2023-11-17T15:06:00Z,The Hunger Games is back on the tip of our tongues as the long-awaited prequel The Ballad of Songbirds and Snakes arrives on November 17. Its a different world than the one where we met Katniss Everd… [+11059 chars], Hunger Games,Lore,
ign,IGN,Jacob Kienlen,How to Watch the Hunger Games Movies in Chronological Order,Should you watch the prequel first?,https://www.ign.com/articles/the-hunger-games-movies-in-order,https://assets-prd.ignimgs.com/2022/04/28/mockingjay1118151280jpg-19b567-1651187649431.jpg?width=1280,2023-11-18T16:30:00Z,"In 2008 Suzanne Collins' unleashed The Hunger Games on the world, launching a bestselling book series that would become a globally beloved franchise. Continuing the legacy of satirical stories like B… [+8287 chars]", Hunger Games,Lore,
,ComingSoon.net,Abdul Azim Naushad,The Ballad of Songbirds & Snakes: Is Jennifer Lawrence’s Katniss in The Hunger Games Prequel?,"Fans want to know whether or not Jennifer Lawrence’s Katniss Everdeen is in The Hunger Games: The Ballad of Songbirds & Snakes. Here is all you need to know. However, beware of spoilers. Is Katniss Everdeen in The Hunger Games: The Ballad of Songbirds & Snake…",https://www.comingsoon.net/guides/news/1406461-hunger-games-ballad-of-songbirds-and-snakes-katniss-everdeen-jennifer-lawrence,"https://www.comingsoon.net/wp-content/uploads/sites/3/2023/11/The-Ballad-of-Songbirds-and-snakes-jennifer-lawrence.jpg?resize=1200,630",2023-11-17T11:30:00Z,"Fans want to know whether or not Jennifer Lawrences Katniss Everdeen is in The Hunger Games: The Ballad of Songbirds &amp; Snakes. Here is all you need to know. However, beware of spoilers.
No, Katn… [+1631 chars]", Hunger Games,Cast,
,Forbes,"Jeff Conway, Senior Contributor, 
 Jeff Conway, Senior Contributor
 https://www.forbes.com/sites/jeffconway/",‘The Hunger Games’ Filmmakers Discuss The Future Of The Franchise,"With ""The Ballad of Songbirds and Snakes"" arriving in theaters, longtime producer Nina Jacobson and director Francis Lawrence analyze this expanding cinematic world.",https://www.forbes.com/sites/jeffconway/2023/11/17/the-hunger-games-filmmakers-discuss-the-future-of-the-franchise/,"https://imageio.forbes.com/specials-images/imageserve/655658deb168f5d894c4eb20/0x0.jpg?format=jpg&crop=1672,940,x0,y60,safe&height=900&width=1600&fit=bounds",2023-11-17T13:30:10Z,"Tom Blyth as Coriolanus Snow and Rachel Zegler as Lucy Gray Baird in ""The Hunger Games: The Ballad ... [+] of Songbirds and Snakes""
Murray Close/Lionsgate
The Hunger Games prequel story, The Ballad… [+9847 chars]", Hunger Games,Cast,
,Deadline,anthonypauldalessandro,‘Hunger Games: Ballad Of Songbirds & Snakes’ Looks To Sing $100M+ Worldwide Opening – Preview,"In what will be a revived week for moviegoing post actors strike heading into the Thanksgiving holiday, Lionsgate’s The Hunger Games: The Ballad of Songbirds & Snakes is looking to lead a global frame with a $100M+ start. The pic is one of four big studio wid…",https://deadline.com/2023/11/hunger-games-ballad-of-songbirds-and-snakes-box-office-opening-1235612652/,https://deadline.com/wp-content/uploads/2023/11/boss-unit-220809-00560-r-e1700063337601.jpg?w=1024,2023-11-15T17:03:31Z,"In what will be a revived week for moviegoing post actors strike heading into the Thanksgiving holiday, Lionsgate’sThe Hunger Games: The Ballad of Songbirds &amp; Snakes is looking to lead a global f… [+5752 chars]", Hunger Games,Production,
,ComingSoon.net,Jeff Ames,Why Catching Fire is the Best Hunger Games Movie,"When The Hunger Games: Ballad of Songbirds & Snakes comes out this week, it’ll have some pretty big shoes to fill. Not only does it have to overcome the massive hole left behind by Jennifer Lawrence, whose performance in the original Hunger Games series catap…",https://www.comingsoon.net/movies/features/1404309-why-catching-fire-is-the-best-hunger-games-movie,"https://www.comingsoon.net/wp-content/uploads/sites/3/2023/11/lawrence.png?resize=1200,630",2023-11-16T23:00:00Z,"When The Hunger Games: Ballad of Songbirds &amp; Snakes comes out this week, itll have some pretty big shoes to fill. Not only does it have to overcome the massive hole left behind by Jennifer Lawren… [+6008 chars]", Hunger Games,Cast,
,ComingSoon.net,Abdul Azim Naushad,The Hunger Games: The Ballad of Songbirds & Snakes Ending Explained & Spoilers,"After The Hunger Games: The Ballad of Songbirds & Snakes‘ ending left many fans speechless, they are curious about what really happened. Here is the ending explained with spoilers. Did Lucy Gray-Baird die? It is unknown if Lucy Gray-Baird died or is still ali…",https://www.comingsoon.net/guides/news/1406664-the-hunger-games-ballad-of-songbirds-and-snakes-ending-explained-spoilers,"https://www.comingsoon.net/wp-content/uploads/sites/3/2023/11/Ballad-of-Songbirds-and-Snakes-Ending-Explained.jpg?resize=1200,630",2023-11-17T13:30:06Z,"After The Hunger Games: The Ballad of Songbirds &amp; Snakes ending left many fans speechless, they are curious about what really happened. Here is the ending explained with spoilers.
Did Lucy Gray-… [+1907 chars]", Hunger Games,Writing,
,ComingSoon.net,Vansh Mehra,The Hunger Games Prequel Box Office Prediction: Will It Flop or Succeed?,"With The Hunger Games prequel, The Ballad of Songbirds & Snakes approaching its release, fans of the franchise are looking at its box office projections. Will the film replicate the original movies’ success, or will it bomb? Here’s all you need to know. How m…",https://www.comingsoon.net/guides/news/1400162-the-hunger-games-prequel-box-office-prediction-ballad-of-songbirds-snakes-movie-flop,"https://www.comingsoon.net/wp-content/uploads/sites/3/2023/11/The-Hunger-Games-Prequel-Box-Office-Prediction.jpg?resize=1200,630",2023-11-13T15:29:55Z,"With The Hunger Games prequel, The Ballad of Songbirds &amp; Snakes approaching its release, fans of the franchise are looking at its box office projections. Will the film replicate the original movi… [+2186 chars]", Hunger Games,Box Office,
,ComingSoon.net,Abdul Azim Naushad,The Hunger Games Prequel Movie Popcorn Bucket: Where to Buy the Container & Cup?,"As the theatrical release of The Hunger Games: The Ballad of Songbirds & Snakes is approaching, fans want to know where they can get their hands on the film’s limited edition popcorn bucket and cup. Here is all you need to know. Where to buy The Hunger Games:…",https://www.comingsoon.net/guides/news/1400250-the-hunger-games-prequel-movie-popcorn-bucket-cup-where-to-buy,"https://www.comingsoon.net/wp-content/uploads/sites/3/2023/11/The-Hunger-Games-Prequel-Movie-Popcorn-Bucket.jpg?resize=1200,630",2023-11-13T15:02:46Z,"As the theatrical release of The Hunger Games: The Ballad of Songbirds &amp; Snakes is approaching, fans want to know where they can get their hands on the films limited edition popcorn bucket and cu… [+1962 chars]", Hunger Games,Box Office,
,Rogerebert.com,Christy Lemire,The Hunger Games: The Ballad of Songbirds & Snakes,A surprisingly suspenseful prequel.,https://www.rogerebert.com/reviews/the-hunger-games-the-ballad-of-songbirds-and-snakes-movie-review-2023,https://s3.amazonaws.com/static.rogerebert.com/uploads/review/primary_image/reviews/the-hunger-games-the-ballad-of-songbirds-and-snakes-movie-review-2023/homepage_the-hunger-games-the-ballad-of-songbirds-and-snakes-movie-review-2023.jpg,2023-11-16T13:46:00Z,"The most gripping aspects of “The Hunger Games: The Ballad of Songbirds & Snakes” don’t even have to do with the actual Hunger Games themselves. They come later, in part three of this lengthy prequel… [+5329 chars]", Hunger Games,Writing,
,Deadline,Valerie Complex,‘The Hunger Games: Ballad of Songbirds & Snakes’ Review: A Tale of Power And Uncertainty In Pre-Katniss Panem,"The book Hunger Games: Ballad of Songbirds & Snakes, written by Suzanne Collins is adapted to screen by director Francis Lawrence, alongside screenwriters Michael Lesslie and Michael Arndt. The film delves into the chillingly formative years of Panem, a socie…",https://deadline.com/2023/11/the-hunger-games-ballad-of-songbirds-amp-snakes-review-a-tale-of-power-1235613182/,https://deadline.com/wp-content/uploads/2023/11/boss-unit-220809-00560-r-e1700063337601.jpg?w=1024,2023-11-15T22:42:39Z,"The book The Hunger Games: The Ballad of Songbirds &amp; Snakes, written by Suzanne Collins, has been adapted for the screen by director Francis Lawrence, alongside screenwriters Michael Lesslie and … [+5342 chars]", Hunger Games,Writing,
