Source ID,Source Name,Author,Title,Description,URL,URL To Image,Published At,Content
,Playstation.com,Ray McCaffrey,Five Nights at Freddy’s: Help Wanted 2 seeks new employees December 14,"I’m Ray McCaffrey, executive producer from Steel Wool Studios, and I speak for our entire time when I say that we’re thrilled to finally give y’all a sneak preview of what you’ll be able to expect in Five Nights at Freddy’s: Help Wanted 2. We will cover the o…",https://blog.playstation.com/2023/11/20/five-nights-at-freddys-help-wanted-2-seeks-new-employees-december-14/,https://blog.playstation.com/tachyon/2023/11/3bcd26b84374a1adf141455184b9bb663735bba5.jpg,2023-11-20T18:01:37Z,"Im Ray McCaffrey, executive producer from Steel Wool Studios, and I speak for our entire time when I say that were thrilled to finally give yall a sneak preview of what youll be able to expect in Fiv… [+3928 chars]"
,/FILM,staff@slashfilm.com (Jacob Hall),How The Ballad Of Songbirds And Snakes Director Made A Vital Hunger Games Prequel [Exclusive Interview],"We sat down with director Francis Lawrence to talk about the intricacies of his new Hunger Games prequel, The Ballad of Songbirds and Snakes.",https://www.slashfilm.com/1449530/hunger-games-ballad-of-songbirds-and-snakes-director-francis-lawrence-interview/,https://www.slashfilm.com/img/gallery/how-the-ballad-of-songbirds-and-snakes-director-made-a-vital-hunger-games-prequel-exclusive-interview/l-intro-1700232610.jpg,2023-11-17T16:14:35Z,"So this is clearly Panem, but decades before the original movies. The reverse engineering of what this world looks like 70 years earlier fascinates me. Can you talk about the directives you and your … [+3978 chars]"
,Destructoid,Andrea Gonzalez,7 of the best RPG Maker horror games you should check out,"RPG Maker and indie horror games have an amazing symbiotic relationship. The engine is relatively cheap and easy to use, even for those who have little experience with coding games. It also has enough flexibility to let creators create wonderful 2D adventures…",https://www.destructoid.com/best-rpg-maker-horror-games/,https://www.destructoid.com/wp-content/uploads/2023/11/ib-steam-page-intro.jpg,2023-11-28T22:31:41Z,"RPG Maker and indie horror games have an amazing symbiotic relationship. The engine is relatively cheap and easy to use, even for those who have little experience with coding games. It also has enoug… [+6614 chars]"
,Gizmodo.com,Germain Lussier,"If There's a Thor 5, Taika Waititi Won't Be Part of It","In one of those rare cases where the rumor mills are actually accurate, director Taika Waititi confirmed that if Marvel Studios decides to make a fifth Thor movie, he won’t be involved. “I wouldn’t know if that’s [a Thor 5 happening] accurate,” Waititi said t…",https://gizmodo.com/thor-5-taika-waititi-chris-hemsworth-marvel-studios-mcu-1851020033,"https://i.kinja-img.com/image/upload/c_fill,h_675,pg_1,q_80,w_1200/1b38864cf164c826de386ea4f40b7d19.jpg",2023-11-14T16:15:00Z,"In one of those rare cases where the rumor mills are actually accurate, director Taika Waititi confirmed that if Marvel Studios decides to make a fifth Thor movie, he wont be involved. I wouldnt know… [+2480 chars]"
,Gizmodo.com,James Whitbrook,"The Marvels Drama, Fallout TV Show Reveals, and More Top Pop Culture News of the Week","It’s been a wild week in the world of sci-fi, fantasy, superheroes, and more genre fare. The return of Doctor Who for its 60th anniversary, burning Mandalorian questions, and our epic first looks at Fallout and Furiosa all made the list of our most read stori…",https://gizmodo.com/top-entertainment-news-fallout-doctor-who-marvel-alien-1851065738,"https://i.kinja-img.com/image/upload/c_fill,h_675,pg_1,q_80,w_1200/7ad4a85d6aa22e76d0ba5d6e534a2e59.jpg",2023-12-02T15:00:00Z,"Its been a wild week in the world of sci-fi, fantasy, superheroes, and more genre fare. The return of Doctor Who for its 60th anniversary, burning Mandalorian questions, and our epic first looks at F… [+3679 chars]"
,Digital Trends,Jason Struss,3 movies and TV shows like Saltburn you have to watch,"If you liked the new movie Saltburn with Jacob Elordi and Barry Keoghan, you should check out these three movies and TV shows that are just like it.",https://www.digitaltrends.com/movies/saltburn-similar-movies-you-have-to-watch/,https://www.digitaltrends.com/wp-content/uploads/2023/11/the-talented-mr-ripley-2.jpg?resize=1200%2C630&p=1,2023-11-25T19:00:38Z,"In the new movie Saltburn, a talented, but poor young man (The Banshees of Inisherin‘s Barry Keoghan) befriends a rich and charismatic fellow student (Priscilla‘s Jacob Elordi) and gets introduced to… [+4532 chars]"
,/FILM,staff@slashfilm.com (Ryan Scott),The Marvels Box Office Was Even Worse Than Expected – What The Heck Happened?,"The Marvels, the latest film in the ongoing Marvel Cinematic Universe, significantly stumbled in its opening weekend, marking the worst MCU opening ever.",https://www.slashfilm.com/1445357/the-marvels-box-office-worse-than-expected-what-happened/,https://www.slashfilm.com/img/gallery/the-marvels-box-office-was-even-worse-than-expected-what-the-heck-happened/l-intro-1699896175.jpg,2023-11-13T18:00:13Z,"It should have been a big weekend at the box office as ""The Marvels,"" the latest entry in the Marvel Cinematic Universe, arrived in theaters. This wasn't just any entry in the multi-billion-dollar fr… [+1493 chars]"
time,Time,Charlie Campbell,How Netflix Is Extending Its Tentacles Across Asia in Search of the Next Squid Game,"Now Netflix is also investing in films in markets like Thailand, Indonesia, and Taiwan in the firm belief that the next Squid Game could come from anywhere.",https://time.com/6339351/netflix-squid-game-asia-expansion/,https://api.time.com/wp-content/uploads/2023/11/netflix-asia-squid-game-1.jpg?quality=85,2023-11-24T06:00:00Z,"Theres no shortage of metrics to gauge the runaway success of Squid Game. The dystopian South Korean death-or-glory drama is Netflixs most-watched series of all time, clocking 1.65 billion viewing ho… [+8910 chars]"
,Biztoc.com,variety.com,"‘Napoleon’ Rules U.K., Ireland Box Office","Sony’s magnum opus “Napoleon,” directed by Ridley Scott, debuted atop the U.K. and Ireland box office with a regal £5.2 million ($6.6 million), according to numbers from Comscore. In its second weekend, Lionsgate’s “The Hunger Games: The Ballad Of Songbirds A…",https://biztoc.com/x/6455de2cead91236,https://c.biztoc.com/p/6455de2cead91236/s.webp,2023-11-28T12:54:08Z,"Sonys magnum opus Napoleon, directed by Ridley Scott, debuted atop the U.K. and Ireland box office with a regal £5.2 million ($6.6 million), according to numbers from Comscore.In its second weekend, … [+279 chars]"
,Forbes,"Mark Hughes, Contributor, 
 Mark Hughes, Contributor
 https://www.forbes.com/sites/markhughes/","‘The Marvels’ Makes Box Office History, ‘The Hunger Games’ Eyes #1 Spot","What cost ""The Marvels"" the box office crown for November, and will ""The Hunger Games: The Ballad of Songbirds and Snakes"" become the month's box office royalty?",https://www.forbes.com/sites/markhughes/2023/11/16/the-marvels-makes-box-office-history-the-hunger-games-eyes-1-spot/,https://imageio.forbes.com/specials-images/imageserve/655599a3039693c028c14a3f/0x0.jpg?format=jpg&height=900&width=1600&fit=bounds,2023-11-16T13:00:00Z,"While Marvel Studios expected The Marvels to blast off to higher box office last weekend, the Captain Marvel sequel from Nia DaCosta still topped the box office for the weekend and officially became … [+7388 chars]"
,ComingSoon.net,Abdul Azim Naushad,Did Jennifer Lawrence Get Plastic Surgery? Star Denies Eye Surgery Rumors,"After rumors about Hollywood star Jennifer Lawrence getting plastic surgery began swirling around the web, fans are curious about whether or not it is the case. Here is how The Hunger Games actress reacted to the rumors. Jennifer Lawrence denies plastic surge…",https://www.comingsoon.net/guides/news/1417169-jennifer-lawrence-on-plastic-surgery-rumors-eye-makeup,"https://www.comingsoon.net/wp-content/uploads/sites/3/2023/11/Jennifer-Lawrence-Plastic-Surgery.jpg?resize=1200,630",2023-11-28T14:39:11Z,"After rumors about Hollywood star Jennifer Lawrence getting plastic surgery began swirling around the web, fans are curious about whether or not it is the case. Here is how The Hunger Games actress r… [+1467 chars]"
,/FILM,staff@slashfilm.com (BJ Colangelo),How To Watch All Of The Hunger Games Movies At Home,"With The Hunger Games: The Ballad of Songbirds and Snakes now playing in theaters, here&amp;#39;s how to watch the Hunger Games movies that came out before.",https://www.slashfilm.com/1451864/how-to-watch-the-hunger-games/,https://www.slashfilm.com/img/gallery/how-to-watch-all-of-the-hunger-games-movies-at-home/l-intro-1700528052.jpg,2023-11-21T17:00:51Z,"Welcome! Welcome, welcome. Happy Hunger Games, and may the odds be ever in your favor. Now, before we begin, we have a very special series of films brought to you all the way from the Capitol ... if … [+1323 chars]"
,IndieWire,Tom Brueggemann,"In the ‘Hunger Games’ of Box Office, ‘Napoleon’ and ‘Wish’ Fall Short of #1 on a Holiday Weekend","Ridley Scott's epic surprisingly topped Disney Animation's latest for #2. Netflix may not be willing to acknowledge it, but ""Maestro"" may represent its best platform opening in years.",https://www.indiewire.com/news/box-office/box-office-hunger-games-napoleon-wish-1234929402/,https://www.indiewire.com/wp-content/uploads/2023/11/M230928_SP006.jpg,2023-11-26T18:57:35Z,"Thanksgiving weekend is normally one of the top-grossing dates. This year, not so much. The debut of two $200 million productions and a second weekend of adequate performance from the “Hunger Games” … [+6813 chars]"
,Deadline,anthonypauldalessandro,Apple’s ‘Napoleon’ Sets Thanksgiving Global Box Office Battle Plan Via Sony With $46M WW Start – Preview,"EXCLUSIVE: Getting a leg-up here on our Thanksgiving stretch preview, Apple Studios production of Ridley Scott’s Napoleon will invade the global box office via Sony this Wednesday, in what’s shaping up to be a $46M WW global start. Split up for the Wednesday-…",https://deadline.com/2023/11/napoleon-global-box-office-opening-projection-1235617741/,https://deadline.com/wp-content/uploads/2023/11/NAPO_Feature_AM_10421_2000x1125_thumbnail.jpg?w=1024,2023-11-18T01:53:37Z,"EXCLUSIVE: Getting a leg-up here on our Thanksgiving stretch preview, Apple Studios production of Ridley Scott’s Napoleonwill invade the global box office via Sony this Wednesday, in what’s shaping u… [+2635 chars]"
,Screen Rant,Brennan Klein,"The Marvels Box Office Plummets, Breaking Another Unfortunate MCU Record","The new MCU sequel The Marvels struggles to maintain a foothold at the domestic box office, breaking another negative franchise record.",https://screenrant.com/the-marvels-box-office-week-3-rank-mcu-record/,https://static1.srcdn.com/wordpress/wp-content/uploads/2023/11/brie-larson-as-captain-marvel-giving-side-eye-in-the-marvels.jpg,2023-11-25T20:34:27Z,"Summary
<ul><li> The Marvels, the latest MCU film, is struggling at the box office, having the lowest opening weekend and steepest week 2 drop in the franchise's history. </li><li> In its third week… [+3094 chars]"
,ComingSoon.net,Joon Dutta Roy,A Few Good Men (1992) Streaming: Watch & Stream Online via AMC Plus,"If you’re wondering where to stream A Few Good Men online, then you have come to the right place. We have all the streaming details. Directed by Rob Reiner, the film follows the military lawyer, Lieutenant Daniel Kaffee. He has a task of defending two marine …",https://www.comingsoon.net/guides/news/1411089-a-few-good-men-1992-streaming-watch-stream-online-via-amc-plus,"https://www.comingsoon.net/wp-content/uploads/sites/3/2023/11/A-Few-Good-Men.jpg?resize=1200,630",2023-11-22T11:52:50Z,"If youre wondering where to stream A Few Good Men online, then you have come to the right place. We have all the streaming details. Directed by Rob Reiner, the film follows the military lawyer, Lieut… [+2354 chars]"
,ComingSoon.net,Disheeta Maheshwari,The Hunger Games Streaming: Watch & Stream Online via Peacock,"The Hunger Games (2012) is an American action film based on Suzanne Collins’ 2008 novel of the same name. It follows Katniss Everdeen and Peeta Mellark from District 12, who are forced to compete in an elaborate game consisting of two teenage contestants from…",https://www.comingsoon.net/guides/news/1395658-the-hunger-games-streaming-watch-stream-online-via-peacock,"https://www.comingsoon.net/wp-content/uploads/sites/3/2023/11/The-Hunger-Games.jpeg?resize=1200,630",2023-11-09T09:40:01Z,"The Hunger Games (2012) is an American action film based on Suzanne Collins 2008 novel of the same name. It follows Katniss Everdeen and Peeta Mellark from District 12, who are forced to compete in a… [+3135 chars]"
,Cracked.com,Ian Garner,Five Things About ‘Five Night at Freddy’s’ That Don’t Suck... Thank God This List Doesn’t Go to Six,"By Ian Garner Published: November 11th, 2023",https://trivia.cracked.com/article_40173_five-things-about-five-night-at-freddys-that-dont-suck-thank-god-this-list-doesnt-go-to-six.html,https://s3.crackedcdn.com/phpimages/article/4/8/5/962485.jpg,2023-11-11T17:30:00Z,"For the better part of a decade, Five Nights at Freddys has been haunting kids and adults alike from behind their computer screens. The point-and-click game harkens back to the kind of thing youd pla… [+6723 chars]"
,Deadline,anthonypauldalessandro,‘Wish’ To Rise Disney Animation’s Star Over Thanksgiving With $75M Global Opening; ‘Napoleon’ Charges For $46M WW – Box Office Preview,"Disney original animation is looking at a comeback this Thanksgiving with the princess pic Wish with as much as $45M-$50M over 5-days after suffering a setback over last year’s holiday with Strangeworld which did $18.8M. With the strikes over, and Thanksgivin…",https://deadline.com/2023/11/wish-napoleon-box-office-thanksgiving-projection-1235630318/,https://deadline.com/wp-content/uploads/2023/11/Wish-Napoleon.jpg?w=1024,2023-11-20T23:31:46Z,Disney original animation is looking at a comeback this Thanksgiving with the princess pic Wishwith as much as $45M-$50M over 5-days after suffering a setback over last year’s holiday with Strangewor… [+4215 chars]
,GameSpot,David Wolinsky,"Iman Vellani On The Marvels Box Office Struggles: ""That's For Bob Iger""","Iman Vellani, back as Kamala Khan/Ms. Marvel in The Marvels, remains unfazed by the film's box office performance since its November 10 release--it opened to $47 million domestically and just under $100 million worldwide, marking the weakest start for a Marve…",https://www.gamespot.com/articles/iman-vellani-on-the-marvels-box-office-struggles-thats-for-bob-iger/1100-6519328/,https://www.gamespot.com/a/uploads/screen_kubrick/1600/16003485/4223217-4217565-the-marvels-captain-marvel-2-poster-international.jpg,2023-11-20T17:46:00Z,"Iman Vellani, back as Kamala Khan/Ms. Marvel in The Marvels, remains unfazed by the film's box office performance since its November 10 release--it opened to $47 million domestically and just under $… [+1614 chars]"
polygon,Polygon,Petrana Radulovic,Hunger Games’ director says Tom Blyth ‘caught me off guard’ as Coriolanus Snow,The Ballad of Songbirds & Snakes stars Rachel Zegler and Tom Blyth. Director Francis Lawrence tells us more about how he landed on the two for the roles.,https://www.polygon.com/23971450/hunger-games-the-ballad-of-songbirds-and-snakes-casting-rachel-zegler-tom-blyth,https://cdn.vox-cdn.com/thumbor/79P7uAZd-ZC2MwwNvNHjBo5e8KU=/0x0:6000x3141/fit-in/1200x630/cdn.vox-cdn.com/uploads/chorus_asset/file/24866240/boss_unit_220920_01273_r.jpg,2023-11-26T19:02:00Z,"Jennifer Lawrence and Josh Hutchersons performances as Katniss Everdeen and Peeta Mellark defined the original Hunger Games movies. But the prequel movie, set 64 years before Katniss and Peetas story… [+3335 chars]"
,The A.V. Club,Sam Barsanti,May the weekend box office be ever in The Ballad Of Songbirds And Snakes’ favor,"After a couple of slow weekends at the domestic box office, things have bounced back nicely thanks to four pretty big new releases that mostly did okay (and one movie with a limited rollout that did relatively good). The biggest of those big new releases is H…",https://www.avclub.com/ballad-of-songbirds-and-snakes-weekend-box-office-1851034814,"https://i.kinja-img.com/image/upload/c_fill,h_675,pg_1,q_80,w_1200/19700a7e4f9abc1bf131bcd0f0a88918.jpg",2023-11-19T22:10:00Z,"After a couple of slow weekends at the domestic box office, things have bounced back nicely thanks to four pretty big new releases that mostly did okay (and one movie with a limited rollout that did … [+1551 chars]"
,/FILM,staff@slashfilm.com (Jenna Busch),The Marvels' Young Avengers Tease Originally Featured More Characters [Exclusive],The Marvels star Iman Vellani has confirmed that she shot a different version of the film&amp;#39;s Young Avengers tease than the one that made the theatrical cut.,https://www.slashfilm.com/1446963/the-marvels-young-avengers-tease-originally-featured-more-characters/,https://www.slashfilm.com/img/gallery/the-marvels-young-avengers-tease-originally-featured-more-characters-exclusive/l-intro-1700051741.jpg,2023-11-15T13:45:30Z,We may end up getting to see the banter between Kate Bishop and Kamala Khan in the film's home media release or a Disney+ special. Considering these two are my absolute favorites of the Young Avenger… [+1201 chars]
,Instapundit.com,Ed Driscoll,BRUCE BAWER: Napoleon: Full of Sound and Fury — But Signifying What? All artists are at the mercy,"BRUCE BAWER: Napoleon: Full of Sound and Fury — But Signifying What? All artists are at the mercy of timing. Sometimes it benefits them, sometimes not. The fact that Napoleon opened just a few weeks after the monstrosities committed by Hamas on Oct. 7 is unfo…",https://instapundit.com/619582/,https://instapundit.com/wp-content/themes/instapundit/images/opengraph-default.png,2023-12-02T18:14:36Z,"All artists are at the mercy of timing. Sometimes it benefits them, sometimes not. The fact that Napoleon opened just a few weeks after the monstrosities committed by Hamas on Oct. 7 is unfortunate f… [+1940 chars]"
,Japan Today,,"'Hunger Games' feasts, 'Napoleon' conquers but 'Wish' doesn't come true at Thanksgiving box office","The Walt Disney Co.’s “Wish” had been expected to rule the Thanksgiving weekend box office, but moviegoers instead feasted on leftovers, as “The Hunger Games: The Ballad of Songbirds and Snakes” led ticket sales for the second weekend, according to studio est…",https://japantoday.com/category/entertainment/%27hunger-games%27-feasts-%27napoleon%27-conquers-but-%27wish%27-doesn%27t-come-true-at-thanksgiving-box-office,,2023-11-26T21:31:14Z,"The Walt Disney Co.s Wish had been expected to rule the Thanksgiving weekend box office, but moviegoers instead feasted on leftovers, as The Hunger Games: The Ballad of Songbirds and Snakes led ticke… [+4801 chars]"
