Source ID,Source Name,Author,Title,Description,URL,URL To Image,Published At,Content
,ComingSoon.net,Disheeta Maheshwari,The Hunger Games: Catching Fire Streaming: Watch & Stream Online via Peacock,"The Hunger Games: Catching Fire is the second installment in The Hunger Games film series based on Suzanne Collins’ second Hunger Games novel. This movie follows Katniss Everdeen and Peeta Mellark after their joint victory in the 74th Hunger Games. However, K…",https://www.comingsoon.net/guides/news/1395664-the-hunger-games-catching-fire-streaming-watch-stream-online-via-peacock,"https://www.comingsoon.net/wp-content/uploads/sites/3/2023/11/The-Hunger-Games-Catching-Fire.jpeg?resize=1200,630",2023-11-09T09:47:15Z,The Hunger Games: Catching Fire is the second installment in The Hunger Games film series based on Suzanne Collins second Hunger Games novel. This movie follows Katniss Everdeen and Peeta Mellark aft… [+3071 chars]
techradar,TechRadar,tom.power@futurenet.com (Tom Power),When is The Marvels coming to Disney Plus?,Want to know when you can watch The Marvels on Disney Plus? We try to answer that question.,https://www.techradar.com/streaming/disney-plus/when-is-the-marvels-coming-to-disney-plus,https://cdn.mos.cms.futurecdn.net/KrKzGiB9XTxNySUDHHYcN4-1200-80.jpg,2023-11-10T08:01:25Z,"The Marvels has finally arrived in theaters – and fans are already asking one big question: when will the superhero film make its Disney Plus debut?
It's a burning query that needs addressing, espec… [+3763 chars]"
,GameSpot,Phil Owen,The Marvels Ending And Mid-Credits Scene Explained,"After several months of delay, Marvel's The Marvels has landed in movie theaters. Despite being the shortest movie in the Marvel Cinematic Universe thus far, The Marvels leaves quite an impact--the ending sets up two separate major plot threads for the future…",https://www.gamespot.com/articles/the-marvels-ending-and-mid-credits-scene-explained/1100-6519080/,https://www.gamespot.com/a/uploads/original/1757/17577455/4219091-marvel%27sthemarvelsendingexplained.jpg,2023-11-10T00:52:00Z,"After several months of delay, Marvel's The Marvels has landed in movie theaters. Despite being the shortest movie in the Marvel Cinematic Universe thus far, The Marvels leaves quite an impact--the e… [+6015 chars]"
,AppleInsider,news@appleinsider.com (Michael Stroup),Mac marvels: B&H Photo unleashes unbeatable deals on Apple hardware,"B&H Photo often has the lowest price on Apple hardware, and this week, it continues the trend of providing outstanding deals. Don't miss a few thrilling deals that bring high performance into your life.Macs on sale at up to $1,900 off.Top deals this week incl…",https://appleinsider.com/articles/23/11/07/mac-marvels-bh-photo-unleashes-unbeatable-deals-on-apple-hardware,https://photos5.appleinsider.com/gallery/57172-116266-Weekly-Deals-(1)-xl.jpg,2023-11-07T18:22:03Z,"Macs on sale at up to $1,900 off.
B&amp;H Photo often has the lowest price on Apple hardware, and this week, it continues the trend of providing outstanding deals. Don't miss a few thrilling deals t… [+3363 chars]"
,Biztoc.com,newsweek.com,Rachel Zegler's red carpet exchange leaves reporter blown away,"One reporter had a wholesome interaction with Hunger Games star Rachel Zegler on the red carpet. Claire Rowden, of MTV UK, was on duty interviewing Zegler and other cast members of The Hunger Games: The Ballad of Songbirds & Snakes. A prequel to the the origi…",https://biztoc.com/x/a796ed544533de3f,https://c.biztoc.com/p/a796ed544533de3f/s.webp,2023-11-10T15:56:09Z,"One reporter had a wholesome interaction with Hunger Games star Rachel Zegler on the red carpet.Claire Rowden, of MTV UK, was on duty interviewing Zegler and other cast members of The Hunger Games: T… [+300 chars]"
ign,IGN,Erik Adams,The Hunger Games: The Ballad of Songbirds and Snakes Review,The prequel rushes Rachel Zegler and Tom Blyth through a rich story that needs more time for its characters’ conflicts and manipulations to feel earned.,https://www.ign.com/articles/the-hunger-games-the-ballad-of-songbirds-and-snakes-review,https://assets-prd.ignimgs.com/2023/11/09/mixcollage-09-nov-2023-12-46-pm-2433-1699555743576.jpg?width=1280,2023-11-09T17:00:00Z,"We know what were in for when we sit down for a Hunger Games movie. Adapted from Suzanne Collins trilogy for young adults, theyre full of commentary-via-metaphor on class, politics, war, propaganda, … [+5487 chars]"
,Deadline,Baz Bamigboye,‘The Hunger Games: The Ballad Of Songbirds & Snakes’ World Premieres As Team Optimistic For More Sequels,"Lionsgate’s The Hunger Games: The Ballad of Songbirds & Snakes had its world premiere at London’s BFI IMAX this evening, with a red carpet that featured director Francis Lawrence and stars Rachel Zegler, Tom Blyth, Hunter Schafer, Josh Andres Rivera and more.…",https://deadline.com/2023/11/the-hunger-games-the-ballad-of-songbirds-and-snakes-world-premiere-1235598133/,https://deadline.com/wp-content/uploads/2023/11/GettyImages-1784399578.jpg?w=1024,2023-11-09T20:44:21Z,"Lionsgate’s The Hunger Games: The Ballad of Songbirds &amp; Snakes had its world premiere at London’s BFI IMAX this evening, with a red carpet that featured director Francis Lawrence and stars Rachel… [+3354 chars]"
,The A.V. Club,Leigh Monson,The Marvels review: The MCU does battle with itself,"It’s no secret these days that Marvel is having something of a crisis behind the scenes, completely revamping their approach to continuity-critical storytelling in their television efforts and scrambling to draw audiences back into theaters in a rudderless po…",https://www.avclub.com/the-marvels-film-review-mcu-brie-larson-1851001733,"https://i.kinja-img.com/image/upload/c_fill,h_675,pg_1,q_80,w_1200/b204992e4ebcf309af625ccd796b77f1.jpg",2023-11-08T17:00:00Z,"Its no secret these days that Marvel is having something of a crisis behind the scenes, completely revamping their approach to continuity-critical storytelling in their television efforts and scrambl… [+4875 chars]"
,GameSpot,Lan Pitts,The Marvels Director Nia DaCosta Explains Finishing The Movie Remotely,"Last week Variety published a report about how some tastemakers and higher-ups at Disney were unhappy and uncertain about the MCU's future. Some concerns were about either having to bring back Avengers alum Scarlet Johannsen and Robert Downey, Jr., as well as…",https://www.gamespot.com/articles/the-marvels-director-nia-dacosta-explains-finishing-the-movie-remotely/1100-6518972/,https://www.gamespot.com/a/uploads/screen_kubrick/1597/15976769/4217565-the-marvels-captain-marvel-2-poster-international.jpg,2023-11-07T18:03:00Z,Last week Variety published a report about how some tastemakers and higher-ups at Disney were unhappy and uncertain about the MCU's future. Some concerns were about either having to bring back Avenge… [+2028 chars]
,GameSpot,Lan Pitts,The Marvels Post-Credits Sequence Leaked--Massive Spoilers,"The post-credit stinger has been a Marvel tradition that started a trend with big-ticket franchise movies where they're almost expected in any feature nowadays. The latest entry for the MCU, The Marvels, will be hitting theaters in just a few days. Still, ear…",https://www.gamespot.com/articles/the-marvels-post-credits-sequence-leaked-massive-spoilers/1100-6519013/,https://www.gamespot.com/a/uploads/screen_kubrick/1597/15976769/4218257-intro-1689925542.jpg,2023-11-08T17:02:00Z,"The post-credit stinger has been a Marvel tradition that started a trend with big-ticket franchise movies where they're almost expected in any feature nowadays. The latest entry for the MCU, The Marv… [+2045 chars]"
,Space.com,Fran Ruiz,'The Marvels' review: A chaotic cosmic headache,"Marvel Studios' latest movie, The Marvels, exhibits all the symptoms of a rusty creative process. Despite some sparse bursts of charm, it lacks quality control.",https://www.space.com/the-marvels-review,https://cdn.mos.cms.futurecdn.net/yQA59729qsQbupbeLoWcj9-1200-80.jpg,2023-11-10T14:59:10Z,"Space is part of Future US Inc, an international media group and leading digital publisher. Visit our corporate site.
©
Future US, Inc. Full 7th Floor, 130 West 42nd Street,
New York,
NY 10036."
,BGR,Chris Smith,The cheap Avengers trick in the final trailer won’t save The Marvels,"The Marvels opens on Friday in theaters around the world. With a few days go to, we have a surprising final trailer for it. It’s …
The post The cheap Avengers trick in the final trailer won’t save The Marvels appeared first on BGR.",https://bgr.com/entertainment/the-cheap-avengers-trick-in-the-final-trailer-wont-save-the-marvels/,https://bgr.com/wp-content/uploads/2023/11/the-marvels-trailer-3-final-7.jpg?quality=82&strip=all,2023-11-08T00:52:00Z,"The Marvels opens on Friday in theaters around the world. With a few days go to, we have a surprising final trailer for it. It’s no wonder Marvel is pulling out of the stops to promote the movie in t… [+4472 chars]"
,Vulture,Joe Reid,A Good Weekend for Miss Priss,"Sofia Coppola’s ‘Priscilla’ makes history at the box office. Plus, leaderboard shakeups, a team name spotlight, and The Marvels on the horizon for the Movies Fantasy League.",http://www.vulture.com/2023/11/sofia-coppola-priscilla-movies-fantasy-league.html,https://pyxis.nymag.com/v1/imgs/b16/a50/ef54c99999cdbf70f74afe1801fcbd4b95-priscilla-MFL.1x.rsocial.w1200.jpg,2023-11-07T21:00:11Z,"This is the latest edition of the Movies Fantasy League newsletter. The drafting window for this season has closed, but you can still sign up to get the newsletter, which provides a weekly recap of b… [+5450 chars]"
,The A.V. Club,Peter Scobel,The Marvels: what to watch before the new MCU movie,"In Binge Club, our experts break down all the films and TV shows you need to brush up on ahead of The Marvels",https://www.avclub.com/the-marvels-what-to-watch-before-the-new-mcu-movie-1851000708,"https://i.kinja-img.com/image/upload/c_fill,h_675,pg_1,q_80,w_1200/c09a7fa80efd33bc749998804355e582.jpg",2023-11-07T22:09:04Z,"In Binge Club, our experts break down all the films and TV shows you need to brush up on ahead of The Marvels
We may earn a commission from links on this page."
,IndieWire,David Ehrlich,‘The Hunger Games: The Ballad of Songbirds & Snakes’ Review: The Rare Hollywood Prequel That Towers Over the Rest of Its Franchise,"Hollywood's obsession with dystopian YA stories might be over, but the sub-genre's best movie just arrived.",https://www.indiewire.com/criticism/movies/hunger-games-ballad-of-songbirds-and-snakes-movie-review-1234923868/,https://www.indiewire.com/wp-content/uploads/2023/11/MV5BOWI1OTMyZGUtYzVmMy00YTZkLWI2ZTEtNDZhOWIzYmRlY2ExXkEyXkFqcGdeQWFybm8@._V1_.jpg,2023-11-09T19:00:00Z,"Does anyone still have an appetite for the Hunger Games? That is the question asked in and by Francis Lawrence’s “The Ballad of Songbirds &amp; Snakes,” a prequel that’s set 64 years before the first… [+13210 chars]"
,Playstation.com,Kristen Zitani (she/her),Share of the Week: Marvel’s Spider-Man 2 – Peter Parker,"Last week, we asked you to share pictures of Peter Parker himself swinging through Marvel’s Spider-Man 2 using #PSshare #PSBlog. Here are this week’s highlights: shimo_ps shares Peter moving through the sky using the Web Wings gunpla_works shares Peter perche…",https://blog.playstation.com/2023/11/10/share-of-the-week-marvels-spider-man-2-peter-parker/,https://blog.playstation.com/tachyon/2023/11/0acd56f2c79c4c230695546f115ab9f992a7901d.jpg,2023-11-10T17:00:29Z,"Last week, we asked you to share pictures of Peter Parker himself swinging through Marvels Spider-Man 2 using #PSshare #PSBlog. Here are this weeks highlights:
shimo_psshares Peter moving through th… [+852 chars]"
,Forbes,"Dani Di Placido, Senior Contributor, 
 Dani Di Placido, Senior Contributor
 https://www.forbes.com/sites/danidiplacido/","The MCU Is Dying, And Only A Supervillain Can Save It","The Marvels is a bomb, and the MCU seems in need of a hero, or rather, a villain.",https://www.forbes.com/sites/danidiplacido/2023/11/12/the-mcu-is-dying-and-only-a-supervillain-can-save-it/,https://imageio.forbes.com/specials-images/imageserve/6551275f1b34604d6a347c4a/0x0.jpg?format=jpg&height=900&width=1600&fit=bounds,2023-11-12T20:02:16Z,"Brie Larson, Teyonah Parris, Iman Vellani, Lashana Lynch, Kevin Feige (President, Marvel Studios)
The Walt Disney Company via Getty Images
The death of the Marvel Cinematic Universe has been predic… [+10667 chars]"
,IndieWire,Ryan Lattanzio,"Ridley Scott: If I Ever Win an Oscar, ‘I’ll Say, About Feckin’ Time’","The ""Napoleon"" director has been nominated four times for directing and producing but has famously never won an Academy Award.",https://www.indiewire.com/news/general-news/ridley-scott-napoleon-oscar-hopes-about-feckin-time-1234923874/,https://www.indiewire.com/wp-content/uploads/2023/11/GettyImages-1342326413.jpg,2023-11-07T20:00:00Z,"He’s won prizes from the Golden Globes, Cannes, and the Directors Guild, but Ridley Scott has never won a little gold man.
The 85-year-old filmmaker, readying to unleash his Joaquin Phoenix-starring… [+2060 chars]"
,ComingSoon.net,Ayeshaasif,The Hunger Games: Mockingjay Part 1 Streaming: Watch & Stream Online via Peacock,"Wondering where to watch The Hunger Games: Mockingjay Part 1 (2014)? You’ve come to the right place, as we’ve got all the streaming details for you. The Hunger Games: Mockingjay Part 1 follows Katniss Everdeen as she becomes the Mockingjay, thus openly rebell…",https://www.comingsoon.net/movies/news/1394343-the-hunger-games-mockingjay-part-1-streaming-watch-stream-online-via-peacock,"https://www.comingsoon.net/wp-content/uploads/sites/3/2023/11/The-Hunger-Games-Mockingjay-Part-1.jpeg?resize=1200,630",2023-11-08T12:42:53Z,"Wondering where to watch The Hunger Games: MockingjayPart 1(2014)? Youve come to the right place, as weve got all the streaming details for you. The Hunger Games: Mockingjay Part 1 follows Katniss Ev… [+3112 chars]"
,ComingSoon.net,Ayeshaasif,The Hunger Games: Mockingjay Part 2 Streaming: Watch & Stream Online via Peacock,"Wondering where to watch The Hunger Games: Mockingjay Part 2? You’ve come to the right place, as we’ve got all the streaming details for you. This is the final movie of the Hunger Games series that follows Katniss Everdeen and her supporters as they lead an o…",https://www.comingsoon.net/movies/news/1394546-the-hunger-games-mockingjay-part-2-streaming-watch-stream-online-via-peacock,"https://www.comingsoon.net/wp-content/uploads/sites/3/2023/11/The-Hunger-Games-Mockingjay-Part-2.jpg?resize=1200,630",2023-11-08T13:17:13Z,"Wondering where to watch The Hunger Games: Mockingjay Part 2? Youve come to the right place, as weve got all the streaming details for you. This is the final movie of the Hunger Games series that fol… [+3014 chars]"
,Nerdist,Rotem Rusak,THE HUNGER GAMES: THE BALLAD OF SONGBIRDS AND SNAKES Centers a Predictable Villain While Its Side Characters Shine,"The Hunger Games: The Ballad of Songbirds and Snakes focused on a fairly predictable villain origin story while its side characters shone.
The post THE HUNGER GAMES: THE BALLAD OF SONGBIRDS AND SNAKES Centers a Predictable Villain While Its Side Characters Sh…",https://nerdist.com/article/the-hunger-games-the-ballad-of-songbirds-and-snakes-review-prequel-movie-delivers-predictable-villain-origin-story/,https://legendary-digital-network-assets.s3.amazonaws.com/wp-content/uploads/2023/05/23103341/The-Hunger-Games-a-Ballad-of-Songbirds-and-Snakes-Lucy-Gray-Baird-and-Coriolanus-Snow.jpg,2023-11-09T19:00:00Z,"An origin story for a true villain is always a complicated prospect, a fine needle to thread. When The Hunger Games: TheBallad of Songbirds and Snakes was first announced, the chief question for me w… [+6913 chars]"
,Forbes,"Hugh McIntyre, Senior Contributor, 
 Hugh McIntyre, Senior Contributor
 https://www.forbes.com/sites/hughmcintyre/",Olivia Rodrigo Is Eligible For An Oscar With Her ‘Hunger Games’ Single,"Olivia Rodrigo's new single ""Can't Catch Me Now"" fronts the soundtrack for the new Hunger Games movie, and it immediately makes her eligible for an Academy Award.",https://www.forbes.com/sites/hughmcintyre/2023/11/07/olivia-rodrigo-is-eligible-for-an-oscar-with-her-hunger-games-single/,https://imageio.forbes.com/specials-images/imageserve/65147fc85b6fd842f5f9d858/0x0.jpg?format=jpg&height=900&width=1600&fit=bounds,2023-11-07T17:00:00Z,"LAS VEGAS, NEVADA - APRIL 03: Olivia Rodrigo accepts the Best Pop Vocal Album award for Sour ... [+] onstage during the 64th Annual GRAMMY Awards at MGM Grand Garden Arena on April 03, 2022 in Las Ve… [+2469 chars]"
,CNET,Max McHone,"Walmart Black Friday Deals: Score Early Savings on Tech, Home Goods and More - CNET","Walmart Plus members get early access to these deals, but everyone will be able to shop hundreds of amazing bargains starting today.",https://www.cnet.com/deals/walmart-black-friday/,https://www.cnet.com/a/img/resize/55048f43dfb341f148bd470fe8ef824b7aca6bde/hub/2023/11/08/b93c0421-934c-49ea-8c13-627afb24cf63/black-friday-walmart-deals.png?auto=webp&fit=crop&height=675&width=1200,2023-11-08T17:02:05Z,"Black Friday falls on Nov. 24 this year, which is still over two weeks away. But this massive sale event is far too big for just one day -- it now spans almost the entire month of November. Several r… [+10856 chars]"
,/FILM,staff@slashfilm.com (Sandy Schaefer),"Is Napoleon Dynamite 2 Happening, Or Should We Just Enjoy Some Tots Without Him?","With Napoleon Dynamite coming up on its 20th anniversary, what are the odds of Jared Hess&amp;#39; cult hit getting a sequel? Here&amp;#39;s everything we know.",https://www.slashfilm.com/1437896/napoleon-dynamite-2-is-it-happening/,https://www.slashfilm.com/img/gallery/is-napoleon-dynamite-2-happening-or-should-we-just-enjoy-some-tots-without-him/l-intro-1699029505.jpg,2023-11-08T10:45:01Z,"Despite being the brainchild of two guys who went to Bringham Young University, ""Napoleon Dynamite"" isn't actually a Mormon film (although the Mormon film industry is a very real thing you can ventur… [+1487 chars]"
,ComingSoon.net,Disheeta Maheshwari,The Hunger Games Streaming: Watch & Stream Online via Peacock,"The Hunger Games (2012) is an American action film based on Suzanne Collins’ 2008 novel of the same name. It follows Katniss Everdeen and Peeta Mellark from District 12, who are forced to compete in an elaborate game consisting of two teenage contestants from…",https://www.comingsoon.net/guides/news/1395658-the-hunger-games-streaming-watch-stream-online-via-peacock,"https://www.comingsoon.net/wp-content/uploads/sites/3/2023/11/The-Hunger-Games.jpeg?resize=1200,630",2023-11-09T09:40:01Z,"The Hunger Games (2012) is an American action film based on Suzanne Collins 2008 novel of the same name. It follows Katniss Everdeen and Peeta Mellark from District 12, who are forced to compete in a… [+3135 chars]"
,/FILM,staff@slashfilm.com (Sandy Schaefer),Everything You Need To Remember To Enjoy The Marvels,"The Marvels is far more than just a sequel to Captain Marvel, so allow us to bring you up to speed on what&amp;#39;s been happening in the MCU lately.",https://www.slashfilm.com/1441807/everything-you-need-remember-enjoy-the-marvels/,https://www.slashfilm.com/img/gallery/everything-you-need-to-remember-to-enjoy-the-marvels/l-intro-1699466596.jpg,2023-11-09T10:45:05Z,"The kids are alright in the MCU, as we saw in the delightful ""Ms. Marvel."" The series introduces Iman Vellani (easily the breakout star of Phase 4 of the MCU) as Kamala Khan, a creative, enthusiastic… [+1506 chars]"
,/FILM,staff@slashfilm.com (Jeremy Mathai),The Marvels Pays Off The Worst Part Of Secret Invasion Ending (Kind Of),"Secret Invasion never really explained why Skrulls couldn&amp;#39;t have a place of their own on Earth like New Asgard, and The Marvels actually rectifies that.",https://www.slashfilm.com/1441875/the-marvels-kinda-pays-off-worst-part-secret-invasion-ending/,https://www.slashfilm.com/img/gallery/the-marvels-pays-off-the-worst-part-of-secret-invasion-ending-kind-of/l-intro-1699469113.jpg,2023-11-10T19:00:00Z,"Warning: This article contains spoilers for ""The Marvels.""
Leave it to the Marvel Cinematic Universe to use their 33rd film in the franchise as a sequel (of sorts) to several properties across multi… [+1625 chars]"
,/FILM,staff@slashfilm.com (Rafael Motamayor),Kamala Khan Is The Future Of The MCU – And The Young Avengers May Be Next,"The Marvels mixes no bones about giving Kamala Khan a critical role in the future of the Marvel Cinematic Universe, and yes, it seems to include Young Avengers.",https://www.slashfilm.com/1441964/kamala-khan-future-mcu-young-avengers/,https://www.slashfilm.com/img/gallery/kamala-khan-is-the-future-of-the-mcu-and-the-young-avengers-may-be-next/l-intro-1699471723.jpg,2023-11-10T12:00:36Z,"The ending of ""The Marvels"" makes it clear that Kamala is taking up the mantle of Nick Fury for the new Avengers. In a weird way, Marvel already assembling a new Avengers team rather than rebuilding … [+1559 chars]"
,/FILM,staff@slashfilm.com (Hannah Shaw-Williams),"The Marvels Heads For $47-52 Million Opening Weekend, A Historic Low For The MCU","The Marvels is projected to set an unenviable record for the Marvel Cinematic Universe, with the lowest opening weekend in the franchise&amp;#39;s history.",https://www.slashfilm.com/1444499/the-marvels-box-office-opening-weekend-lowest-mcu/,https://www.slashfilm.com/img/gallery/the-marvels-heads-for-47-52-million-opening-weekend-an-historic-low-for-the-mcu/l-intro-1699721779.jpg,2023-11-11T17:10:40Z,"For about a decade or so, Marvel Cinematic Universe movies were such a solid bet at the box office that a sequel grossing ""only"" $644 million was considered a low point. But following the departure o… [+1621 chars]"
,/FILM,staff@slashfilm.com (Sandy Schaefer),What Critics And Fans Are Saying About The Marvels,"2023 has been a rough year for the MCU, but does The Marvels end things on a high note? Here&amp;#39;s what critics and fans are saying about the film.",https://www.slashfilm.com/1443799/what-critics-fans-saying-the-marvels/,https://www.slashfilm.com/img/gallery/what-critics-and-fans-are-saying-about-the-marvels/l-intro-1699635348.jpg,2023-11-10T17:18:32Z,"To say the /Film team is mixed on ""The Marvels"" would be a bit of an understatement. In his review, Jeremy Mathai wrote that ""Vellani's big-screen debut singlehandedly makes 'The Marvels' worth your … [+2198 chars]"
,/FILM,staff@slashfilm.com (BJ Colangelo),The Marvels Credit Scene (And That Surprise Character Cameo) Explained,"Stay in your seat when the credits start rolling on The Marvels, because the post-credits scene teases a major shake-up for the MCU.",https://www.slashfilm.com/1442608/the-marvels-post-credits-scene-explained/,https://www.slashfilm.com/img/gallery/the-marvels-credits-scene-explained/l-intro-1699541016.jpg,2023-11-09T23:00:00Z,"This article containsmajor spoilersfor ""The Marvels.""
Whether you loved it (like I did) or hated it, the latest addition to the Marvel Cinematic Universe, Nia DaCosta's ""The Marvels,"" is mandatory v… [+1519 chars]"
,/FILM,staff@slashfilm.com (BJ Colangelo),The Marvels Final Trailer Promises A Moment That Changes Everything,"The final trailer for the latest entry in the Marvel Cinematic Universe, The Marvels, has arrived ahead of its release on November 10.",https://www.slashfilm.com/1440150/the-marvels-final-trailer-moment-changes-everything/,https://www.slashfilm.com/img/gallery/the-marvels-final-trailer-promises-a-moment-that-changes-everything/l-intro-1699328695.jpg,2023-11-07T03:50:07Z,"Ahead of the film's release on November 10, 2023, Marvel Studios debuted the final trailer for ""The Marvels,"" the latest addition to the Marvel Cinematic Universe. Directed by Nia DaCosta (""Candyman,… [+1598 chars]"
,/FILM,staff@slashfilm.com (Bill Bria),The Marvels Ending Explained: Let The Sunshine In,"The Marvels connects Captain Marvel to the series Ms. Marvel and WandaVision, but here&amp;#39;s a complete guide to everything you need to know about the ending.",https://www.slashfilm.com/1442358/the-marvels-ending-explained/,https://www.slashfilm.com/img/gallery/the-marvels-ending-explained-let-the-sunshine-in/l-intro-1699498250.jpg,2023-11-09T22:00:00Z,"Dar-Benn makes a plea to the leader of the now-nomadic Skrulls, Emperor Dro'ge (Gary Lewis), on the Skrulls' temporary home of Tarnax: let her relocate the Skrulls and then use the bangle to open a j… [+1530 chars]"
,/FILM,staff@slashfilm.com (William Bibbiani),Howard The Duck Isn't The First Marvel Comics Movie – The Real One Came Out One Year Earlier,"Red Sonja deserves to wear the crown of Marvels first live-action theatrical feature, even if that means Howard the Duck loses the crown.",https://www.slashfilm.com/1437484/howard-the-duck-isnt-first-marvel-comics-movie-red-sonja/,https://www.slashfilm.com/img/gallery/howard-the-duck-isnt-the-first-marvel-comics-movie-the-real-one-came-out-one-year-earlier/l-intro-1698968444.jpg,2023-11-07T21:00:57Z,"Somehow, the makers of the ""Red Sonja"" movie got away with using Roy Thomas and Barry Windsor-Smith's almost completely original version of the character without actually crediting them, or even cred… [+1684 chars]"
