Source ID,Source Name,Author,Title,Description,URL,URL To Image,Published At,Content
,Vulture,Joe Reid,MCU Drafters Take a Marv-‘L’,"An update in the Movies Fantasy League standings include box office implications from ‘The Marvels’ and ‘The Holdovers,’ plus, a deep dive into a very special mini-league: AllOfUsGarys!",http://www.vulture.com/2023/11/mcu-the-marvels-the-holdovers-box-office-movies-fantasy-league.html,https://pyxis.nymag.com/v1/imgs/bda/268/6ab7a46317a54874573bab2826bcf01837-mfl-11-13-2023.1x.rsocial.w1200.jpg,2023-11-14T17:00:19Z,"This is the latest edition of the Movies Fantasy League newsletter. The drafting window for this season has closed, but you can still sign up to get the newsletter, which provides a weekly recap of b… [+7666 chars]"
,Deadline,anthonypauldalessandro,Apple’s ‘Napoleon’ Sets Thanksgiving Global Box Office Battle Plan Via Sony With $46M WW Start – Preview,"EXCLUSIVE: Getting a leg-up here on our Thanksgiving stretch preview, Apple Studios production of Ridley Scott’s Napoleon will invade the global box office via Sony this Wednesday, in what’s shaping up to be a $46M WW global start. Split up for the Wednesday-…",https://deadline.com/2023/11/napoleon-global-box-office-opening-projection-1235617741/,https://deadline.com/wp-content/uploads/2023/11/NAPO_Feature_AM_10421_2000x1125_thumbnail.jpg?w=1024,2023-11-18T01:53:37Z,"EXCLUSIVE: Getting a leg-up here on our Thanksgiving stretch preview, Apple Studios production of Ridley Scott’s Napoleonwill invade the global box office via Sony this Wednesday, in what’s shaping u… [+2635 chars]"
,Kotaku,Ethan Gach,Suicide Squad's Seasonal Content And Characters Will Be Free,"Rocksteady Studios emphasized that Suicide Squad: Kill the Justice League will be a story-driven action adventure in its latest deep-dive reveal, but its post-launch plans seem to still fall very squarely into the live-service mold. The studio provided more d…",https://kotaku.com/suicide-squad-battle-pass-free-characters-early-access-1851025270,"https://i.kinja-img.com/image/upload/c_fill,h_675,pg_1,q_80,w_1200/329b37d2c938f63964ea06b30a9b7a0d.jpg",2023-11-15T19:45:00Z,"Rocksteady Studios emphasized that Suicide Squad: Kill the Justice League will be a story-driven action adventure in its latest deep-dive reveal, but its post-launch plans seem to still fall very squ… [+2113 chars]"
ign,IGN,Scott Collura,Why The Hunger Games Matters Now More Than Ever,"With the prequel movie The Ballad of Songbirds and Snakes hitting theaters, we're looking at why The Hunger Games is more relevant now than ever.",https://www.ign.com/articles/why-the-hunger-games-matters-now-more-than-ever,https://assets-prd.ignimgs.com/2023/11/17/hungergames-blogroll-1700179653585.jpg?width=1280,2023-11-17T15:06:00Z,The Hunger Games is back on the tip of our tongues as the long-awaited prequel The Ballad of Songbirds and Snakes arrives on November 17. Its a different world than the one where we met Katniss Everd… [+11059 chars]
ign,IGN,Jacob Kienlen,How to Watch the Hunger Games Movies in Chronological Order,Should you watch the prequel first?,https://www.ign.com/articles/the-hunger-games-movies-in-order,https://assets-prd.ignimgs.com/2022/04/28/mockingjay1118151280jpg-19b567-1651187649431.jpg?width=1280,2023-11-18T16:30:00Z,"In 2008 Suzanne Collins' unleashed The Hunger Games on the world, launching a bestselling book series that would become a globally beloved franchise. Continuing the legacy of satirical stories like B… [+8287 chars]"
,GameSpot,Evan Campbell,The Marvels Has The Worst MCU Box Office Debut Ever,"Captain Marvel might be the most powerful Avenger, but that didn't help the superhero's sequel at the box office. The Marvels just opened with the worst start ever for the MCU by pulling in $47 million domestically--$110.3 total when adding in international m…",https://www.gamespot.com/articles/the-marvels-has-the-worst-mcu-box-office-debut-ever/1100-6519110/,https://www.gamespot.com/a/uploads/screen_kubrick/1813/18138562/4219718-4218321-4191963-themarvels_27x40.jpg,2023-11-13T14:31:00Z,"Captain Marvel might be the most powerful Avenger, but that didn't help the superhero's sequel at the box office. The Marvels just opened with the worst start ever for the MCU by pulling in $47 milli… [+1842 chars]"
,ComingSoon.net,Abdul Azim Naushad,The Ballad of Songbirds & Snakes: Is Jennifer Lawrence’s Katniss in The Hunger Games Prequel?,"Fans want to know whether or not Jennifer Lawrence’s Katniss Everdeen is in The Hunger Games: The Ballad of Songbirds & Snakes. Here is all you need to know. However, beware of spoilers. Is Katniss Everdeen in The Hunger Games: The Ballad of Songbirds & Snake…",https://www.comingsoon.net/guides/news/1406461-hunger-games-ballad-of-songbirds-and-snakes-katniss-everdeen-jennifer-lawrence,"https://www.comingsoon.net/wp-content/uploads/sites/3/2023/11/The-Ballad-of-Songbirds-and-snakes-jennifer-lawrence.jpg?resize=1200,630",2023-11-17T11:30:00Z,"Fans want to know whether or not Jennifer Lawrences Katniss Everdeen is in The Hunger Games: The Ballad of Songbirds &amp; Snakes. Here is all you need to know. However, beware of spoilers.
No, Katn… [+1631 chars]"
,Xataka.com,Javier Marquez,Ya conocemos todos los nominados de The Game Awards 2023 (y hay malas noticias para Bethesda y ‘Starfield’),"El 7 de diciembre se celebrará en Los Ángeles la décima edición de The Game Awards. Como cada año por estas fechas, la organización del evento ha anunciado los nominados. En la lista encontramos títulos como ‘Alan Wake 2’ y ‘Baldur's Gate 3’, que recibieron l…",https://www.xataka.com/videojuegos/conocemos-todos-nominados-the-game-awards-2023-hay-malas-noticias-para-bethesda-starfield,https://i.blogs.es/e4c267/juegos-nominados-the-game-awards-2023-2/840_560.jpeg,2023-11-13T20:10:16Z,"El 7 de diciembre se celebrará en Los Ángeles la décima edición de The Game Awards. Como cada año por estas fechas, la organización del evento ha anunciado los nominados. En la lista encontramos títu… [+10916 chars]"
,Forbes,"Jeff Conway, Senior Contributor, 
 Jeff Conway, Senior Contributor
 https://www.forbes.com/sites/jeffconway/",‘The Hunger Games’ Filmmakers Discuss The Future Of The Franchise,"With ""The Ballad of Songbirds and Snakes"" arriving in theaters, longtime producer Nina Jacobson and director Francis Lawrence analyze this expanding cinematic world.",https://www.forbes.com/sites/jeffconway/2023/11/17/the-hunger-games-filmmakers-discuss-the-future-of-the-franchise/,"https://imageio.forbes.com/specials-images/imageserve/655658deb168f5d894c4eb20/0x0.jpg?format=jpg&crop=1672,940,x0,y60,safe&height=900&width=1600&fit=bounds",2023-11-17T13:30:10Z,"Tom Blyth as Coriolanus Snow and Rachel Zegler as Lucy Gray Baird in ""The Hunger Games: The Ballad ... [+] of Songbirds and Snakes""
Murray Close/Lionsgate
The Hunger Games prequel story, The Ballad… [+9847 chars]"
,Screen Rant,Lukas Shayo,Hunger Games Prequel Shoots Past The Marvels For The #1 Spot At The Box Office,"The Hunger Games prequel, The Ballad of Songbirds and Snakes, officially shoots past The Marvels to secure the #1 spot at the weekend box office.",https://screenrant.com/hunger-games-ballad-songbirds-snakes-opening-box-office-marvels-beat/,https://static1.srcdn.com/wordpress/wp-content/uploads/2023/11/lucy-and-snow-in-ballad-of-songbirds-and-snakes.jpg,2023-11-18T18:36:31Z,"Summary
<ul><li>The Hunger Games: The Ballad of Songbirds and Snakes has claimed the top spot at the box office, beating out its competitors. </li><li> This prequel adaptation explores the early lif… [+3125 chars]"
,GQ Magazine,Eileen Cartter,Red Carpet Menswear Is Back,"From Saltburn’s Jacob Elordi and Barry Keoghan to new Hunger Games star Tom Blyth, the no-rules era of pre-strike Hollywood dressing has resumed.",https://www.gq.com/story/post-strike-red-carpet-premieres-saltburn-hunger-games,"https://media.gq.com/photos/65550a66f0c4989b4e932373/16:9/w_1280,c_limit/1794208914",2023-11-16T22:10:24Z,"I missed this, a grinning Barry Keoghan told photographers on the red carpet at the Saltburn premiere in Los Angeles this week. The Irish actor joined his co-star (and GQ 2023 Men of the Year honoree… [+989 chars]"
,Gizmodo.com,Sabina Graves,Destin Daniel Cretton Departs Marvel's Avengers: The Kang Dynasty,"Photo: Frazer Harrison (Getty Images)
With so many things in flux at Marvel Studios, there’s news from that Shang-Chi And the Legend of the The Ten Rings director Destin Daniel Cretton has departed the director’s chair of Marvel Studios’ Avengers: The Kang D…",https://gizmodo.com/destin-daniel-cretton-departs-avengers-the-kang-dynasty-1851025565,"https://i.kinja-img.com/image/upload/c_fill,h_675,pg_1,q_80,w_1200/4349f645212ba55d844dff905ae090c6.jpg",2023-11-15T20:10:00Z,"With so many things in flux at Marvel Studios, theres news thatShang-Chi And the Legend of the The Ten Rings director Destin Daniel Cretton has departed the directors chair of Marvel Studios Avengers… [+2040 chars]"
,The A.V. Club,Scott Huver,All The Marvels Easter eggs and references explained,"For better or worse, a certain level of fluency in the ever-expanding tapestry of the Marvel Cinematic Universe is required by The Marvels. While the film—which brings together Captain Marvel’s Carol Danvers (Brie Larson), WandaVision’s Monica Rambeau (Teyona…",https://www.avclub.com/the-marvels-easter-eggs-movie-explained-1851008620,"https://i.kinja-img.com/image/upload/c_fill,h_675,pg_1,q_80,w_1200/dc7b591e654f663a4b047700fc73fbb5.jpg",2023-11-13T14:00:00Z,"For better or worse, a certain level of fluency in the ever-expanding tapestry of the Marvel Cinematic Universe is required by The Marvels. While the filmwhich brings together Captain Marvels Carol D… [+10139 chars]"
,Deadline,anthonypauldalessandro,‘Hunger Games: Ballad Of Songbirds & Snakes’ Looks To Sing $100M+ Worldwide Opening – Preview,"In what will be a revived week for moviegoing post actors strike heading into the Thanksgiving holiday, Lionsgate’s The Hunger Games: The Ballad of Songbirds & Snakes is looking to lead a global frame with a $100M+ start. The pic is one of four big studio wid…",https://deadline.com/2023/11/hunger-games-ballad-of-songbirds-and-snakes-box-office-opening-1235612652/,https://deadline.com/wp-content/uploads/2023/11/boss-unit-220809-00560-r-e1700063337601.jpg?w=1024,2023-11-15T17:03:31Z,"In what will be a revived week for moviegoing post actors strike heading into the Thanksgiving holiday, Lionsgate’sThe Hunger Games: The Ballad of Songbirds &amp; Snakes is looking to lead a global f… [+5752 chars]"
,ComingSoon.net,Jeff Ames,Why Catching Fire is the Best Hunger Games Movie,"When The Hunger Games: Ballad of Songbirds & Snakes comes out this week, it’ll have some pretty big shoes to fill. Not only does it have to overcome the massive hole left behind by Jennifer Lawrence, whose performance in the original Hunger Games series catap…",https://www.comingsoon.net/movies/features/1404309-why-catching-fire-is-the-best-hunger-games-movie,"https://www.comingsoon.net/wp-content/uploads/sites/3/2023/11/lawrence.png?resize=1200,630",2023-11-16T23:00:00Z,"When The Hunger Games: Ballad of Songbirds &amp; Snakes comes out this week, itll have some pretty big shoes to fill. Not only does it have to overcome the massive hole left behind by Jennifer Lawren… [+6008 chars]"
,Playstation.com,Kristen Zitani (she/her),Share of the Week: Marvel’s Spider-Man 2 – Miles Morales,"Last week, we asked you to share pictures of Miles Morales moving through the world of Marvel’s Spider-Man 2 using #PSshare #PSBlog. Here are this week’s highlights: calisarah1998 shares Miles shooting webs wearing the Shadow-Spider Suit FrameCaptureVP shares…",https://blog.playstation.com/2023/11/17/share-of-the-week-marvels-spider-man-2-miles-morales/,https://blog.playstation.com/tachyon/2023/11/729be85af19ff18d3f089b9503afdaa23dcaada0.jpg,2023-11-17T17:00:21Z,"Last week, we asked you to share pictures of Miles Morales moving through the world of Marvels Spider-Man 2 using #PSshare #PSBlog. Here are this weeks highlights:
calisarah1998shares Miles shooting… [+849 chars]"
,ComingSoon.net,Abdul Azim Naushad,The Hunger Games: The Ballad of Songbirds & Snakes Ending Explained & Spoilers,"After The Hunger Games: The Ballad of Songbirds & Snakes‘ ending left many fans speechless, they are curious about what really happened. Here is the ending explained with spoilers. Did Lucy Gray-Baird die? It is unknown if Lucy Gray-Baird died or is still ali…",https://www.comingsoon.net/guides/news/1406664-the-hunger-games-ballad-of-songbirds-and-snakes-ending-explained-spoilers,"https://www.comingsoon.net/wp-content/uploads/sites/3/2023/11/Ballad-of-Songbirds-and-Snakes-Ending-Explained.jpg?resize=1200,630",2023-11-17T13:30:06Z,"After The Hunger Games: The Ballad of Songbirds &amp; Snakes ending left many fans speechless, they are curious about what really happened. Here is the ending explained with spoilers.
Did Lucy Gray-… [+1907 chars]"
,ComingSoon.net,Vansh Mehra,The Hunger Games Prequel Box Office Prediction: Will It Flop or Succeed?,"With The Hunger Games prequel, The Ballad of Songbirds & Snakes approaching its release, fans of the franchise are looking at its box office projections. Will the film replicate the original movies’ success, or will it bomb? Here’s all you need to know. How m…",https://www.comingsoon.net/guides/news/1400162-the-hunger-games-prequel-box-office-prediction-ballad-of-songbirds-snakes-movie-flop,"https://www.comingsoon.net/wp-content/uploads/sites/3/2023/11/The-Hunger-Games-Prequel-Box-Office-Prediction.jpg?resize=1200,630",2023-11-13T15:29:55Z,"With The Hunger Games prequel, The Ballad of Songbirds &amp; Snakes approaching its release, fans of the franchise are looking at its box office projections. Will the film replicate the original movi… [+2186 chars]"
,ComingSoon.net,Abdul Azim Naushad,The Hunger Games Prequel Movie Popcorn Bucket: Where to Buy the Container & Cup?,"As the theatrical release of The Hunger Games: The Ballad of Songbirds & Snakes is approaching, fans want to know where they can get their hands on the film’s limited edition popcorn bucket and cup. Here is all you need to know. Where to buy The Hunger Games:…",https://www.comingsoon.net/guides/news/1400250-the-hunger-games-prequel-movie-popcorn-bucket-cup-where-to-buy,"https://www.comingsoon.net/wp-content/uploads/sites/3/2023/11/The-Hunger-Games-Prequel-Movie-Popcorn-Bucket.jpg?resize=1200,630",2023-11-13T15:02:46Z,"As the theatrical release of The Hunger Games: The Ballad of Songbirds &amp; Snakes is approaching, fans want to know where they can get their hands on the films limited edition popcorn bucket and cu… [+1962 chars]"
,Gofugyourself.com,Jessica,Hunter Schafer Continues to Absolutely Nail This Hunger Games Promo Tour,"It's been so fun.
The post Hunter Schafer Continues to Absolutely Nail This Hunger Games Promo Tour first appeared on Go Fug Yourself.",https://www.gofugyourself.com/hunter-schafer-continues-to-absolutely-nail-this-hunger-games-promo-tour-11-2023,https://static.gofugyourself.com/uploads/2023/11/GettyImages-1786605077-1700186270.jpg,2023-11-17T19:06:28Z,"Listen, I personally suspect this Hunger Games iteration is going to sink like a stone because I just don’t think people are dialed into that franchise anymore — but who knows? I’ve been wrong about … [+491 chars]"
,Rogerebert.com,Christy Lemire,The Hunger Games: The Ballad of Songbirds & Snakes,A surprisingly suspenseful prequel.,https://www.rogerebert.com/reviews/the-hunger-games-the-ballad-of-songbirds-and-snakes-movie-review-2023,https://s3.amazonaws.com/static.rogerebert.com/uploads/review/primary_image/reviews/the-hunger-games-the-ballad-of-songbirds-and-snakes-movie-review-2023/homepage_the-hunger-games-the-ballad-of-songbirds-and-snakes-movie-review-2023.jpg,2023-11-16T13:46:00Z,"The most gripping aspects of “The Hunger Games: The Ballad of Songbirds & Snakes” don’t even have to do with the actual Hunger Games themselves. They come later, in part three of this lengthy prequel… [+5329 chars]"
,Gofugyourself.com,Jessica,“The Hunger Games: The Ballad Of Songbirds & Snakes” Makes It To New York,"Hnter Schafer continues to kill this.
The post “The Hunger Games: The Ballad Of Songbirds & Snakes” Makes It To New York first appeared on Go Fug Yourself.",https://www.gofugyourself.com/the-hunger-games-the-ballad-of-songbirds-snakes-makes-it-to-new-york-11-2023,https://static.gofugyourself.com/uploads/2023/11/GettyImages-1795638811-1700097915.jpg,2023-11-16T18:12:10Z,"This is the post where I congratulate everyone’s stylists for getting to flaunt their skills again. These premieres have been turning out so well! Post-strike group hug!!
[Photos: Dia Dipasupil/Gett… [+8 chars]"
,Deadline,Armando Tinoco,‘The Hunger Games’ Star Rachel Zegler Recalls Meeting Jennifer Lawrence Jokingly Wanting To Strangle Her For Photo,"Rachel Zegler stars in The Hunger Games: The Ballad of Songbirds & Snakes and recently recalled an encounter she had with OG star Jennifer Lawrence. While making an appearance on The Kelly Clarkson Show, Zegler opened up about meeting Lawrence during the Chri…",https://deadline.com/2023/11/the-hunger-games-rachel-zegler-meeting-jennifer-lawrence-1235618635/,https://deadline.com/wp-content/uploads/2023/11/hunger-games-jennifer-lawrence-rachel-zegler.jpg?w=1024,2023-11-18T23:40:12Z,"Rachel Zegler stars in The Hunger Games: The Ballad of Songbirds &amp; Snakes and recently recalled an encounter she had with OG star Jennifer Lawrence.
While making an appearance on The Kelly Clark… [+1555 chars]"
,Deadline,Valerie Complex,‘The Hunger Games: Ballad of Songbirds & Snakes’ Review: A Tale of Power And Uncertainty In Pre-Katniss Panem,"The book Hunger Games: Ballad of Songbirds & Snakes, written by Suzanne Collins is adapted to screen by director Francis Lawrence, alongside screenwriters Michael Lesslie and Michael Arndt. The film delves into the chillingly formative years of Panem, a socie…",https://deadline.com/2023/11/the-hunger-games-ballad-of-songbirds-amp-snakes-review-a-tale-of-power-1235613182/,https://deadline.com/wp-content/uploads/2023/11/boss-unit-220809-00560-r-e1700063337601.jpg?w=1024,2023-11-15T22:42:39Z,"The book The Hunger Games: The Ballad of Songbirds &amp; Snakes, written by Suzanne Collins, has been adapted for the screen by director Francis Lawrence, alongside screenwriters Michael Lesslie and … [+5342 chars]"
,Biztoc.com,nytimes.com,‘The Hunger Games’ Is Back. Here’s What You Need to Know,"Arriving eight years after the most recent film in the franchise, “The Hunger Games” is back with a new installment: “The Ballad of Songbirds & Snakes.” Adapted from a 2020 novel by Suzanne Collins, the author who created the “Hunger Games,” this film serves …",https://biztoc.com/x/9f71da6dde3db4ed,https://c.biztoc.com/p/9f71da6dde3db4ed/s.webp,2023-11-17T18:52:14Z,"Arriving eight years after the most recent film in the franchise, The Hunger Games is back with a new installment: The Ballad of Songbirds &amp; Snakes. Adapted from a 2020 novel by Suzanne Collins, … [+280 chars]"
,Biztoc.com,deadline.com,‘Hunger Games: Ballad Of Songbirds & Snakes’: Spotify A Key Partner In Country Music Infused Prequel,"Music has continually been a facet of Lionsgate‘s $3 billion Hunger Games franchise going back to ditties from Taylor Swift, Coldplay and Lorde, and with today’s theatrical release of Lionsgate’s The Hunger Games: The Ballad of Songbirds & Snakes, the studio …",https://biztoc.com/x/d292e45dd90a3923,https://c.biztoc.com/p/d292e45dd90a3923/s.webp,2023-11-17T17:10:33Z,"Music has continually been a facet of Lionsgates $3 billion Hunger Games franchise going back to ditties from Taylor Swift, Coldplay and Lorde, and with todays theatrical release of Lionsgates The Hu… [+301 chars]"
,Biztoc.com,thewrap.com,‘Hunger Games: Ballad of Songbirds and Snakes’ Earns $5.75 Million at Thursday Box Office,"“The Hunger Games: The Ballad of Songbirds and Snakes” began its domestic box office sprint with $5.75 million in Thursday preview showings. That’s well below, understandably, the $16 million earned via preview showings of “The Hunger Games: Mockingjay Part I…",https://biztoc.com/x/26dcc990cf6001fc,https://c.biztoc.com/p/26dcc990cf6001fc/s.webp,2023-11-17T17:08:51Z,"The Hunger Games: The Ballad of Songbirds and Snakes began its domestic box office sprint with $5.75 million in Thursday preview showings. Thats well below, understandably, the $16 million earned via… [+306 chars]"
,Deadline,Armando Tinoco,Olivia Rodrigo Drops ‘Can’t Catch Me Now’ Music Video For ‘The Hunger Games: The Ballad Of Songbirds & Snakes’ Soundtrack,Olivia Rodrigo is contributing her music to the soundtrack for The Hunger Games: The Ballad of Songbirds & Snakes with “Can’t Catch Me Now.” The High School Musical: The Musical: The Series alum attended the premiere of the film in L.A. as her music video als…,https://deadline.com/2023/11/olivia-rodrigo-cant-catch-me-now-music-video-the-hunger-games-the-ballad-of-songbirds-and-snakes-soundtrack-1235603759/,https://deadline.com/wp-content/uploads/2023/11/olivia-rodrigo-the-hunger-games-the-ballad-of-songbirds-and-snakes.jpg?w=1024,2023-11-14T04:15:51Z,"Olivia Rodrigo is contributing her music to the soundtrack for The Hunger Games: The Ballad of Songbirds &amp; Snakes with “Can’t Catch Me Now.” 
The High School Musical: The Musical: The Series alu… [+1972 chars]"
ign,IGN,Jordan Sirani,How to Watch The Hunger Games Prequel – Release Date and Streaming Status,It's supposed to be pretty good actually.,https://www.ign.com/articles/how-to-watch-the-hunger-games-ballad-of-songbirds-and-snakes,https://assets-prd.ignimgs.com/2023/11/09/mixcollage-09-nov-2023-12-46-pm-2433-1699555743576.jpg?width=1280,2023-11-16T01:02:00Z,"Eight years after the original Hunger Games film series concluded, moviegoers will return to the fictional country of Panem to witness the 10th Hunger Games. The prequel is set 64 years before Katnis… [+3576 chars]"
,CBR - Comic Book Resources,Jon Mendelsohn,Hunger Games – The Ballad of Songbirds and Snakes Review,"This Hunger Games prequel provides intriguing performances and some insight into the early days of Panem, but fails to keep the momentum throughout.",https://www.cbr.com/hunger-games-songbirds-and-snakes-review/,https://static1.cbrimages.com/wordpress/wp-content/uploads/2023/11/hunger-games-the-ballad-of-songbirds-and-snakes-main-characters.jpg,2023-11-16T17:35:16Z,"In 2012, a little film based on a YA book series by Suzanne Collins was released to the world. The Hunger Games became a worldwide cinematic phenomenon and catapulted its leading actress, Jennifer La… [+8842 chars]"
,Forbes,"Conor Murray, Forbes Staff, 
 Conor Murray, Forbes Staff
 https://www.forbes.com/sites/conormurray/",New ‘Hunger Games’ Prequel Faces Franchise’s Worst Average Reviews—Ahead Of Expected $50 Million Opening,The film is also expected to have the franchise’s worst opening weekend at the box office by a large margin—but box office analysts still expect solid revenue.,https://www.forbes.com/sites/conormurray/2023/11/16/new-hunger-games-prequel-faces-franchises-worst-average-reviews-ahead-of-expected-50-million-opening/,"https://imageio.forbes.com/specials-images/imageserve/6556929e82e488c18fddcafc/0x0.jpg?format=jpg&crop=2605,1465,x72,y50,safe&height=900&width=1600&fit=bounds",2023-11-16T22:08:43Z,"The Hunger Games: The Ballad of Songbirds and Snakes opens in theaters Friday, and it already has the lowest Rotten Tomatoes critics score of any of the films in the franchise, at a lukewarm 63%as ea… [+5116 chars]"
,IndieWire,David Ehrlich,‘Napoleon’ Review: Ridley Scott and Joaquin Phoenix Deliver a Film That Works Better as a Comedy Than a Historical Epic,Those worried about a glorification of the dictator needn't have feared. You won't be prepared for the way this film utterly humiliates the one-time Emperor of France.,https://www.indiewire.com/criticism/movies/napoleon-review-ridley-scott-joaquin-phoenix-1234926076/,https://www.indiewire.com/wp-content/uploads/2023/07/Napoleon.png,2023-11-15T00:00:41Z,Ridley Scott has never been shy about mocking the infinite smallness of man’s thirst for power (a tendency made all the more enjoyable by the cigar-chomping brio of a director who runs his sets like … [+8738 chars]
,/FILM,staff@slashfilm.com (William Bibbiani),There's One Thing The Marvels Does Better Than Avengers: Endgame,"Avengers: Endgame is way more financially successful than The Marvels, but at least the new film meaningfully addresses the underlying concerns of its villain.",https://www.slashfilm.com/1445835/one-thing-the-marvels-does-better-than-avengers-endgame/,https://www.slashfilm.com/img/gallery/theres-one-thing-the-marvels-does-better-than-avengers-endgame/l-intro-1699914793.jpg,2023-11-14T13:00:14Z,"This post contains spoilers for ""The Marvels.""
In ""The Marvels,"" Captain Marvel, Ms. Marvel, and Monica Rambeau (the latter of whom, we will, in accordance with Kamala Khan, henceforth call ""Profess… [+1279 chars]"
