Source ID,Source Name,Author,Title,Description,URL,URL To Image,Published At,Content
,ComingSoon.net,Jeff Ames,Box Office Results: Hunger Games Prequel Rises to the Top as Marvels Sinks,"There are plenty of pros and cons at the box office this week. We’ll start with the good news. The Hunger Games prequel, The Ballad of Songbirds & Snakes, opened with a decent but not spectacular $44 million, enough to propel the Francis Lawrence-directed pic…",https://www.comingsoon.net/movies/news/1407231-box-office-results-hunger-games-prequel-rises-to-the-top-as-marvels-sinks,"https://www.comingsoon.net/wp-content/uploads/sites/3/2023/11/Songbirds.png?resize=1200,630",2023-11-19T22:12:24Z,"There are plenty of pros and cons at the box office this week. Well start with the good news. The Hunger Games prequel, The Ballad of Songbirds &amp; Snakes, opened with a decent but not spectacular … [+2660 chars]"
,Dark Horizons,Garth Franklin,“Hunger Games” Prequel Wins Thanksgiving,Lionsgate’s “The Hunger Games: The Ballad of Songbirds and Snakes” looks set to emerge as the victor of the Thanksgiving holiday box-office. The film is set to beat both Disney’s animated adventure “Wish” and Apple and Sony’s historical epic “Napoleon” after …,https://www.darkhorizons.com/hunger-games-prequel-wins-thanksgiving/,https://cdndark.darkhorizons.com/wp-content/uploads/2023/11/hunger-games-prequel-wins-thanksgiving.jpg,2023-11-25T19:52:49Z,"Lionsgate’s “The Hunger Games: The Ballad of Songbirds and Snakes” looks set to emerge as the victor of the Thanksgiving holiday box-office.
The film is set to beat both Disney’s animated adventure … [+1443 chars]"
,/FILM,staff@slashfilm.com (Ryan Scott),The Marvels To Finish Box Office Run As Lowest-Grossing MCU Movie Ever,"Disney will cease reporting box office numbers for The Marvels after just four weekends, as the MCU movie limps towards the finish line.",https://www.slashfilm.com/1461809/marvels-box-office-lowest-grossing-mcu/,https://www.slashfilm.com/img/gallery/the-marvels-to-finish-box-office-run-as-lowest-grossing-mcu-movie-ever/l-intro-1701710991.jpg,2023-12-04T18:00:49Z,We will be analyzing what went wrong here for years to come but let's be clear: there is nothing to celebrate. It's bad for movie theaters that were depending on this movie to help keep ticket sales … [+1563 chars]
,Twistedsifter.com,Matthew Gilligan,‘This feels very Hunger Games.’ Walmart Shopper Gets An Order Dropped From The Sky By A Drone,I can't wait until I can do this where I live!,http://twistedsifter.com/2023/11/this-feels-very-hunger-games-walmart-shopper-gets-an-order-dropped-from-the-sky-by-a-drone/,https://twistedsifter.com/wp-content/uploads/2023/11/TikTokDroneDrop.png,2023-11-30T09:36:57Z,"I don’t know about you, but I simply can’t wait until drone delivery is available where I live.
I have no idea if or when that’s going to happen, but I’m ready for it!
A woman named Sarah posted a … [+1308 chars]"
,/FILM,staff@slashfilm.com (Jeremy Mathai),Taika Waititi's Next Goal Wins Is 2023's Latest Box Office Bomb,"Despite its low budget, Taika Waititi&amp;#39;s delayed sports comedy Next Goal Wins is unlikely to recoup its costs at the box office. But what went wrong, exactly?",https://www.slashfilm.com/1451305/taika-waititi-next-goal-wins-box-office-bomb/,https://www.slashfilm.com/img/gallery/taika-waititis-next-goal-wins-is-2023s-latest-box-office-bomb/l-intro-1700500983.jpg,2023-11-20T19:00:13Z,"Is it fair to say that Taika Waititi has lost a bit of his luster lately? Once having flown high on the strength of his early indies (""Eagle vs Shark,"" ""Boy,"" and ""What We Do in the Shadows"" hive ris… [+1591 chars]"
,/FILM,staff@slashfilm.com (Ben Pearson),"Next Goal Wins Feels Like A '90s Throwback, But It Forgot One Crucial Component","Taika Waititi built his career on making great hang out films featuring memorable characters. With Next Goal Wins, he abandoned that approach - and it cost him.",https://www.slashfilm.com/1451546/next-goal-wins-90s-throwback-forgot-crucial-component/,https://www.slashfilm.com/img/gallery/next-goal-wins-feels-like-a-90s-throwback-but-it-forgot-one-crucial-component/l-intro-1700508081.jpg,2023-11-20T22:10:18Z,"In films like ""What We Do in the Shadows"" and ""Hunt for the Wilderpeople,"" Waititi excelled at highlighting supporting casts that felt like real human beings (or aliens, or vampires, depending on the… [+1571 chars]"
,Screen Rant,Zak Wojnar,Due Justice Interview: Efren Ramirez On His Hard Boiled Detective & The Endearing Cult Of Pedro,"Screen Rant interviews Efren Ramirez about the themes behind his new film, Due Justice, and the continuing legacy of Pedro from Napoleon Dynamite.",https://screenrant.com/due-justice-movie-efren-ramirez-interview/,https://static1.srcdn.com/wordpress/wp-content/uploads/2023/12/efranramirez_duejustice_yt.jpg,2023-12-04T14:30:23Z,"Summary
<ul><li> Efren Ramirez stars alongside Kellan Lutz and Jeff Fahey in Due Justice, a vigilante action thriller with standout performances. </li><li> Ramirez plays Detective Santiago, a burned… [+8592 chars]"
