Source ID,Source Name,Author,Title,Description,URL,URL To Image,Published At,Content
,/FILM,staff@slashfilm.com (Michael Boyle),The Ballad Of Songbirds And Snakes Director Will Make Another Hunger Games Under One Condition,"Director Francis Lawrence is game to make another Hunger Games film after Ballad of Snakes and Songbirds, but only if Suzanne Collins writes a new novel first.",https://www.slashfilm.com/1449952/the-ballad-of-songbirds-and-snakes-director-make-another-hunger-games-under-one-condition/,https://www.slashfilm.com/img/gallery/the-ballad-of-songbirds-and-snakes-director-will-make-another-hunger-games-under-one-condition/l-intro-1700249606.jpg,2023-11-19T17:00:46Z,"With the latest ""Hunger Games"" movie, ""The Ballad of Songbirds and Snakes,"" now out in theaters, viewers might be wondering: Is this the last one? There are still 73 in-universe Hunger Games we've ne… [+1510 chars]"
,/FILM,staff@slashfilm.com (Witney Seibold),Did Josephine Actually Love Napoleon? Ridley Scott Has Thoughts,Were Napoleon Bonaparte (played by Joaquin Phoenix) and Jos&eacute;phine de Beauharnais (played by Vanessa Kirby) really in love? Ridley Scott has thoughts.,https://www.slashfilm.com/1447928/did-josephine-love-napoleon-ridley-scott-has-thoughts/,https://www.slashfilm.com/img/gallery/did-josephine-actually-love-napoleon-ridley-scott-has-thoughts/l-intro-1700079025.jpg,2023-11-22T21:00:00Z,"In Ridley Scott's new historical biopic ""Napoleon,"" the relationship between Napoleon Bonaparte (Joaquin Phoenix) and Joséphine de Beauharnais (Vanessa Kirby) is depicted as refreshingly direct and e… [+1454 chars]"
,Screen Rant,Ryan Northrup,Hunger Games: The Ballad of Songbirds and Snakes Gets Brutally Honest Poster For The Bloated Prequel,"A fan-made poster for The Hunger Games: The Ballad of Songbirds of Snakes has been released, poking fun at one common criticism of the prequel.",https://screenrant.com/hunger-games-ballad-songbirds-snakes-poster-parody/,https://static1.srcdn.com/wordpress/wp-content/uploads/2023/11/rachel-zegler-the-hunger-games-ballad-of-songbirds-and-snakes.jpg,2023-11-27T19:26:52Z,"Summary
<ul><li> A mock poster for The Hunger Games: The Ballad of Songbirds and Snakes makes fun of the movie's long runtime, retitling the movie to ""Three Hour Hunger Games Prequel"". </li><li> Rev… [+3494 chars]"
,Digital Trends,Blair Marnell,7 video game movie and TV adaptations we can’t wait to watch,What's going to be the next great video game adaptation? We've got seven video games in mind that are already optioned for films and TV shows.,https://www.digitaltrends.com/movies/seven-video-game-adaptations-we-cant-wait-to-watch/,https://www.digitaltrends.com/wp-content/uploads/2023/07/BioShock-Big-Daddy.jpg?resize=1200%2C630&p=1,2023-11-16T15:00:24Z,"For decades, video game adaptations have been ridiculed for failing to live up to the games that inspired them, or by the way they flopped at the box office. That changed in a big way this year, incl… [+6014 chars]"
,/FILM,staff@slashfilm.com (Bill Bria),Napoleon Ending Explained: The French Mistake,"Let&amp;#39;s put on our bicorne spoiler hats and look at the ending of Ridley Scott&amp;#39;s historical epic Napoleon, starring Joaquin Phoenix and Vanessa Kirby.",https://www.slashfilm.com/1452810/napoleon-ending-explained/,https://www.slashfilm.com/img/gallery/napoleon-ending-explained-the-french-mistake/l-intro-1700603216.jpg,2023-11-22T12:00:00Z,"Like so many problematic figures of history and fiction, Napoleon (like Marie at the beginning of the film) comes to an ignoble end. Instead of dying a hero or with honor on the battlefield, he's kep… [+1934 chars]"
,IndieWire,Proma Khosla,Kamala Khan Is Marvel’s Not-So-Secret Weapon,"Iman Vellani's wide-eyed teen hero is the saving grace of ""The Marvels"" — and the solid foundation for a new Marvel era.",https://www.indiewire.com/features/commentary/kamala-khan-is-the-marvels-mcu-future-1234924237/,https://www.indiewire.com/wp-content/uploads/2023/11/GRO-01822_RC-1.jpg,2023-11-11T20:00:00Z,"The Marvel Cinematic Universe is well past its peak.
All is not lost just yet, however, as there is still a panoply of costume heroes lining up to save the galaxy from danger or time travel or god-k… [+4215 chars]"
,Space.com,Kimberley Snaith,Save 20% on Lego's Hoopty spaceship from The Marvels this Black Friday,Grab yourself an $18 saving on this fun Lego ship from The Marvels this Black Friday.,https://www.space.com/lego-the-marvels-hoopty-spaceship-black-friday-2023,https://cdn.mos.cms.futurecdn.net/N7uxGtTocxscvc45kVAHN4-1200-80.jpg,2023-11-24T21:45:39Z,"Space is part of Future US Inc, an international media group and leading digital publisher. Visit our corporate site.
©
Future US, Inc. Full 7th Floor, 130 West 42nd Street,
New York,
NY 10036."
,BGR,Jacob Siegal,The Marvels flopping is more proof that the MCU is on life support,"Before The Marvels premiered on November 10th, I figured the bleak projections would end up being an overreaction. After all, Pixar’s Elemental looked like a …
The post The Marvels flopping is more proof that the MCU is on life support appeared first on BGR.",https://bgr.com/entertainment/the-marvels-flopping-is-more-proof-that-the-mcu-is-on-life-support/,https://bgr.com/wp-content/uploads/2023/11/The-Marvels.jpg?quality=82&strip=all,2023-11-21T00:06:00Z,"Before The Marvels premiered on November 10th, I figured the bleak projections would end up being an overreaction. After all, Pixar’s Elemental looked like a flop on its opening weekend but went on t… [+3581 chars]"
,The A.V. Club,Sam Barsanti,Ballad Of Songbirds And Snakes' Rachel Zegler always pictured herself starring in this movie,"With the SAG-AFTRA strike finally over, actors can get back to work acting and doing promotional stuff to promote their acting. Hunger Games prequel The Ballad Of Songbirds And Snakes had gotten an interim agreement in October, so its stars could’ve promoted …",https://www.avclub.com/ballad-of-songbirds-and-snakes-rachel-zegler-star-1851015626,"https://i.kinja-img.com/image/upload/c_fill,h_675,pg_1,q_80,w_1200/1db03fc6cc80a2c65c938054eeb9b666.jpg",2023-11-12T20:50:00Z,"With the SAG-AFTRA strike finally over, actors can get back to work acting and doing promotional stuff to promote their acting. Hunger Games prequel The Ballad Of Songbirds And Snakeshad gotten an in… [+1810 chars]"
,/FILM,staff@slashfilm.com (Witney Seibold),"The Marvels Musical Planet Scene Was Originally Longer, And Iman Vellani Loved It [Exclusive]",Iman Vellani loved filming the musical sequence on Aladna in The Marvels but was disappointed to see how much of it was left out of the theatrical cut.,https://www.slashfilm.com/1446867/the-marvels-musical-planet-scene-longer-iman-vellani-loved-it/,https://www.slashfilm.com/img/gallery/the-marvels-musical-planet-scene-was-originally-longer-and-iman-vellani-loved-it-exclusive/l-intro-1699995259.jpg,2023-11-14T22:00:55Z,"When asked about the cut and/or reshot scenes for ""The Marvels,"" Vellani was forthcoming, saying:
""There's a longer version of the Aladna dance. I am a musical theater nerd, and I loved it. They sen… [+1523 chars]"
,The A.V. Club,Sam Barsanti,Ridley Scott on Napoleon complaints from French critics: “the French don’t even like themselves”,"Earlier this month, as part of a New Yorker profile, Napoleon director Ridley Scott suggested that anyone pointing out historical inaccuracies in his film should “get a life” (which seems fair, if bluntly stated, because that kind of very-online anti-fun/crea…",https://www.avclub.com/ridley-scott-napoleon-french-critics-1851034530,"https://i.kinja-img.com/image/upload/c_fill,h_675,pg_1,q_80,w_1200/130c4c63ca983bcd222c8230ae1d75c0.jpg",2023-11-19T17:51:00Z,"Earlier this month, as part of a New Yorker profile, Napoleondirector Ridley Scott suggested that anyone pointing out historical inaccuracies in his film should get a life (which seems fair, if blunt… [+1907 chars]"
,GameSpot,Eddie Makuch,Disney CEO Explains Why He Believes The Marvels Fell Short At The Box Office,"The newest MCU movie, The Marvels, debuted this month and had the slowest start at the box office in the history of the MCU. Disney CEO Bob Iger recently discussed the film's commercial shortcomings, saying the poor results were due, in part, to a lack of exe…",https://www.gamespot.com/articles/disney-ceo-explains-why-he-believes-the-marvels-fell-short-at-the-box-office/1100-6519574/,https://www.gamespot.com/a/uploads/screen_kubrick/1179/11799911/4228070-marvelslarge.jpeg,2023-11-30T13:42:00Z,"The newest MCU movie, The Marvels, debuted this month and had the slowest start at the box office in the history of the MCU. Disney CEO Bob Iger recently discussed the film's commercial shortcomings,… [+1825 chars]"
,TMZ,TMZ Staff,"Disney's Latest Movie, 'Wish,' Flops Over Thanksgiving Weekend","Another miss from Disney at the box office -- the studio's latest original animated movie bombed with moviegoers over the holiday break ... marking just the latest flop for 'em. Of course, we're talking about 'Wish' ... with Ariana DeBose as the…",https://www.tmz.com/2023/11/26/disney-new-animated-movie-wish-flop-bomb-thanksgiving-box-office/,https://imagez.tmz.com/image/34/16by9/2023/11/26/345bce439c5b47438cf2d2590b0b0e9a_xl.png,2023-11-26T18:46:36Z,"Another miss from Disney at the box office -- the studio's latest original animated movie bombed with moviegoers over the holiday break ... marking just the latest flop for 'em.
Of course, we're tal… [+1514 chars]"
,International Business Times,AFP News,'Hunger Games' Still Tops In N.America After 'Napoleon' Invades,"The ""Hunger Games"" prequel stayed atop the North American box office over the long US Thanksgiving weekend, fending off an invasion by new Ridley Scott film ""Napoleon,"" industry watcher Exhibitor Relations reported Sunday.",https://www.ibtimes.com/hunger-games-still-tops-namerica-after-napoleon-invades-3719429,https://d.ibtimes.com/en/full/4500967/us-actor-joaquin-phoenix-star-new-ridley-scott-epic-napoleon-poses-november-20-2023-event.jpg,2023-11-26T18:45:31Z,"The ""Hunger Games"" prequel stayed atop the North American box office over the long US Thanksgiving weekend, fending off an invasion by new Ridley Scott film ""Napoleon,"" industry watcher Exhibitor Rel… [+2518 chars]"
,Gizmodo.com,Sabina Graves,Hot Toys' New Spider-Man Figure Is Ripped Right From the Comics,"Spidey swings off the page in this upcoming release, and he even comes with a camera for taking pictures... pictures of Spider-Man.",https://gizmodo.com/hot-toys-amazing-spider-man-comic-book-inspire-camera-1851066425,"https://i.kinja-img.com/image/upload/c_fill,h_675,pg_1,q_80,w_1200/32837a53a070db53e7c7012b16ca02ae.jpg",2023-12-01T20:05:00Z,"Heres a first look at the latest Spider-Man figure from collectible giants Hot Toys.
This rendering of the Amazing Spider-Man is inspired by Marvels web-slinging action, complete with pop-out comic … [+626 chars]"
,Rolling Stone,Brian Hiattt,‘The Marvels’ Star Teyonah Parris Cried When She Learned She Was an MCU Superhero,"“I get to be a part of the imagery I wanted to see more of as a young girl,” says Parris, who first appeared as Monica Rambeau in ‘WandaVision.’",https://www.rollingstone.com/tv-movies/tv-movie-features/the-marvels-teyonah-parris-interview-monica-rambeau-mcu-wandavision-1234876027/,https://www.rollingstone.com/wp-content/uploads/2023/11/teyonah-parris-the-marvels.jpg?w=1600&h=900&crop=1,2023-11-12T14:50:17Z,"The rocky current state of the Marvel Cinematic Universe is partly due to its over-extension into too many streaming shows of varyingquality — but at the same time, the best of those series have intr… [+6855 chars]"
,GeekTyrant,Jessica Fisher,Disney CEO Bob Iger Believes THE MARVELS Flopped Because There Wasn't Enough Executive Supervision on Set,"Disney and Marvel’s latest, The Marvels, was a fun time at the movies, but it unfortunately didn’t do so well at the box office, which is kind of on par with superhero flicks at the moment. Some say it’s superhero fatigue, some say it’s the studio’s choice of…",https://geektyrant.com/news/disney-ceo-bob-iger-says-he-believes-the-marvels-flopped-because-there-wasnt-enough-executive-supervision-on-set,http://static1.squarespace.com/static/51b3dc8ee4b051b96ceb10de/51ce6099e4b0d911b4489b79/656934ac7ddb2a7cace59d20/1701462330932/THE-MARVELS-Credit_-Marvel-Studios.jpeg?format=1500w,2023-12-01T20:25:00Z,"Disney and Marvels latest, The Marvels, was a fun time at the movies, but it unfortunately didnt do so well at the box office, which is kind of on par with superhero flicks at the moment. Some say it… [+1271 chars]"
,ComingSoon.net,Disheeta Maheshwari,The Hunger Games Streaming: Watch & Stream Online via Peacock,"The Hunger Games (2012) is an American action film based on Suzanne Collins’ 2008 novel of the same name. It follows Katniss Everdeen and Peeta Mellark from District 12, who are forced to compete in an elaborate game consisting of two teenage contestants from…",https://www.comingsoon.net/guides/news/1395658-the-hunger-games-streaming-watch-stream-online-via-peacock,"https://www.comingsoon.net/wp-content/uploads/sites/3/2023/11/The-Hunger-Games.jpeg?resize=1200,630",2023-11-09T09:40:01Z,"The Hunger Games (2012) is an American action film based on Suzanne Collins 2008 novel of the same name. It follows Katniss Everdeen and Peeta Mellark from District 12, who are forced to compete in a… [+3135 chars]"
,TMZ,TMZ Staff,"Disney's Latest Movie, 'Wish,' Flops Over Thanksgiving Weekend","Another miss from Disney at the box office -- the studio's latest original animated movie bombed with moviegoers over the holiday break ... marking just the latest flop for 'em. Of course, we're talking about 'Wish' ... with Ariana DeBose as the…",https://www.tmz.com/2023/11/26/disney-new-animated-movie-wish-flop-bomb-thanksgiving-box-office/,https://imagez.tmz.com/image/34/16by9/2023/11/26/345bce439c5b47438cf2d2590b0b0e9a_xl.png,2023-11-26T18:46:36Z,"Another miss from Disney at the box office -- the studio's latest original animated movie bombed with moviegoers over the holiday break ... marking just the latest flop for 'em.
Of course, we're tal… [+1514 chars]"
,Eonline.com,Alyssa Morin,Jennifer Lawrence Shakes Off Her Wardrobe Mishap in the Most J-Law Way,"The fashion odds may have not been in Jennifer Lawrence's favor, but she didn't let it throw off her game.
The Hunger Games alum recently handled a wardrobe malfunction like a total pro while...",https://www.eonline.com/news/1390335/jennifer-lawrence-brushes-off-her-wardrobe-malfunction-like-a-pro,"https://akns-images.eonline.com/eol_images/Entire_Site/20231020/cr_1200x1200-231120181729-GettyImages-1804969181.jpg?fit=around%7C1080:1080&output-quality=90&crop=1080:1080;center,top",2023-11-22T22:28:56Z,"The fashion odds may have not been in Jennifer Lawrence's favor, but she didn't let it throw off her game.
The Hunger Games alum recently handled a wardrobe malfunction like a total pro while attend… [+691 chars]"
,IndieWire,Tom Brueggemann,"Marvel Taught Us That Movies Need to Be Events, but the MCU No Longer Qualifies","""The Marvels"" is a disaster while ""Priscilla"" and ""The Holdovers"" both stay strong. ""Dream Scenario"" and ""Tiger 3"" thrive in platform release.",https://www.indiewire.com/news/box-office/the-marvels-movies-need-to-be-events-mcu-no-longer-qualifies-1234925594/,https://www.indiewire.com/wp-content/uploads/2023/11/GRO-01822_RC-1.jpg,2023-11-12T19:00:00Z,Box-office highlights of 2023 include the breakout successes of “Barbie” and “Oppenheimer” and disruptor titles like “Sound of Freedom” and “Taylor Swift: The Eras Tour.” We’ve also seen the weakness… [+7827 chars]
,The A.V. Club,Sam Barsanti,Beyoncé defeats Godzilla Minus One to claim the weekend box office crown,"Move over superhero movies, the hot new thing in American cinemas is apparently concert films. After Taylor Swift: The Eras Tour made nearly $180 million over the last eight weeks, Beyoncé has arrived to do her part in taking over the theater industry. Renais…",https://www.avclub.com/beyonce-box-office-renaissance-1851069314,"https://i.kinja-img.com/image/upload/c_fill,h_675,pg_1,q_80,w_1200/8b8a0d9399df51bf2b2c2ce4cc263cc7.jpg",2023-12-03T21:18:00Z,"Move over superhero movies, the hot new thing in American cinemas is apparently concert films. After Taylor Swift: The Eras Tour made nearly $180 million over the last eight weeks, Beyoncé has arrive… [+1757 chars]"
,/FILM,staff@slashfilm.com (Jenna Busch),The Marvels' Young Avengers Tease Originally Featured More Characters [Exclusive],The Marvels star Iman Vellani has confirmed that she shot a different version of the film&amp;#39;s Young Avengers tease than the one that made the theatrical cut.,https://www.slashfilm.com/1446963/the-marvels-young-avengers-tease-originally-featured-more-characters/,https://www.slashfilm.com/img/gallery/the-marvels-young-avengers-tease-originally-featured-more-characters-exclusive/l-intro-1700051741.jpg,2023-11-15T13:45:30Z,We may end up getting to see the banter between Kate Bishop and Kamala Khan in the film's home media release or a Disney+ special. Considering these two are my absolute favorites of the Young Avenger… [+1201 chars]
,ComingSoon.net,Neil Bolt,Five Nights at Freddy’s Movie Digital Release Date Revealed for US and UK,"The Five Nights at Freddy’s movie digital release date has been revealed, and UK fans frustrated by a lack of at-home viewing options will not have to wait too long. Five Nights at Freddy’s Movie Digital Release Date Prime Video has the Five Nights at Freddy’…",https://www.comingsoon.net/movies/news/1409746-five-nights-at-freddys-movie-digital-release-date,"https://www.comingsoon.net/wp-content/uploads/sites/3/2023/11/five-nights-at-freddys-digital-release-date.jpg?resize=1200,630",2023-11-21T13:35:59Z,"The Five Nights at Freddys movie digital release date has been revealed, and UK fans frustrated by a lack of at-home viewing options will not have to wait too long.
Prime Video has the Five Nights a… [+1663 chars]"
,The A.V. Club,Peter Scobel,The Marvels: what to watch before the new MCU movie,"In Binge Club, our experts break down all the films and TV shows you need to brush up on ahead of The Marvels",https://www.avclub.com/the-marvels-what-to-watch-before-the-new-mcu-movie-1851000708,"https://i.kinja-img.com/image/upload/c_fill,h_675,pg_1,q_80,w_1200/c09a7fa80efd33bc749998804355e582.jpg",2023-11-07T22:09:04Z,"In Binge Club, our experts break down all the films and TV shows you need to brush up on ahead of The Marvels
We may earn a commission from links on this page."
time,Time,Olivia B. Waxman,How Ridley Scott’s Napoleon Stacks Up Against the French Emperor’s Real Story,"A Napoleon scholar breaks down where Ridley Scott's new movie, starring Joaquin Phoenix, hews close to history, and where it takes creative license.",https://time.com/6338563/napoleon-movie-true-story/,https://api.time.com/wp-content/uploads/2023/11/NAPO_Feature_AM_10421_2000x1125_thumbnail.jpg?quality=85,2023-11-22T14:15:00Z,"Ridley Scotts biopic Napoleon, in which Joaquin Phoenix plays the French emperor, hits theaters on Nov. 22. The film tracks Napoleons rise to fame during the French Revolution, delves deep into his l… [+10638 chars]"
,The A.V. Club,Sam Barsanti,"Bob Iger throws Nia DaCosta under the bus, says The Marvels needed more “supervision” from execs","Marvel’s The Marvels stands as the biggest box office flop in the history of the MCU, having made less than $80 million domestically since it came out about a month ago, and while star Iman Vellani doesn’t care and is happy with the work she did, others are d…",https://www.avclub.com/bob-iger-the-marvels-supervision-execs-1851062343,"https://i.kinja-img.com/image/upload/c_fill,h_675,pg_1,q_80,w_1200/446aac91727a052ae206d233d8a21006.jpg",2023-11-30T19:06:00Z,"Marvels The Marvelsstands as the biggest box office flop in the history of the MCU, having made less than $80 million domestically since it came out about a month ago, and while star Iman Vellani doe… [+1493 chars]"
,Just Jared,Just Jared,Disney CEO Explains Why He Believes 'The Marvels' Flopped at the Box Office,"Disney CEO Bob Iger is sharing his thoughts on the box-office performance of The Marvels. The Marvel Cinematic Universe’s latest movie failed to attract the masses, as it scored the lowest opening weekend of any of the franchise’s titles, earning just $47 mil…",https://www.justjared.com/2023/12/01/disney-ceo-explains-why-he-believes-the-marvels-flopped-at-the-box-office/,https://cdn01.justjared.com/wp-content/uploads/headlines/2023/12/bob-iger-explains-the-marvels-box-office1.jpg,2023-12-02T02:00:48Z,"Disney CEO Bob Iger is sharing his thoughts on the box-office performance of The Marvels.
The Marvel Cinematic Universe’s latest movie failed to attract the masses, as it scored the lowest opening w… [+1413 chars]"
,ComingSoon.net,Abdul Azim Naushad,The Hunger Games: The Ballad of Songbirds & Snakes Ending Explained & Spoilers,"After The Hunger Games: The Ballad of Songbirds & Snakes‘ ending left many fans speechless, they are curious about what really happened. Here is the ending explained with spoilers. Did Lucy Gray-Baird die? It is unknown if Lucy Gray-Baird died or is still ali…",https://www.comingsoon.net/guides/news/1406664-the-hunger-games-ballad-of-songbirds-and-snakes-ending-explained-spoilers,"https://www.comingsoon.net/wp-content/uploads/sites/3/2023/11/Ballad-of-Songbirds-and-Snakes-Ending-Explained.jpg?resize=1200,630",2023-11-17T13:30:06Z,"After The Hunger Games: The Ballad of Songbirds &amp; Snakes ending left many fans speechless, they are curious about what really happened. Here is the ending explained with spoilers.
Did Lucy Gray-… [+1907 chars]"
,/FILM,staff@slashfilm.com (Hannah Shaw-Williams),The Hunger Games Emerges As The Surprise Victor Of 2023's Thanksgiving Box Office,"The odds weren&amp;#39;t in The Hunger Games: The Ballad of Songbirds and Snakes&amp;#39; favor, but the prequel has held on to the box office top spot over Thanksgiving.",https://www.slashfilm.com/1454981/hunger-games-ballad-songbirds-snakes-thanksgiving-box-office/,https://www.slashfilm.com/img/gallery/the-hunger-games-emerges-as-the-surprise-victor-of-thanksgiving-weekend-box-office/l-intro-1700932860.jpg,2023-11-25T18:22:15Z,"The most exciting thing about the Hunger Games, citizens of the Capitol would probably argue, is that anyone can win. The first ""Hunger Games"" movie saw the strongest, fastest tributes, who had volun… [+1499 chars]"
,Digital Trends,Blair Marnell,"7 best cosmic Marvel characters ever, ranked","There are more heroes in space than The Marvels. Let's dive into the seven best cosmic Marvel characters, most of whom aren't in the MCU!",https://www.digitaltrends.com/movies/7-best-cosmic-marvel-characters-ranked/,https://www.digitaltrends.com/wp-content/uploads/2023/05/Cosmic-Ghost-Rider.jpg?resize=1200%2C630&p=1,2023-11-11T13:00:18Z,"The Marvels isn’t the only movie or piece of content that features Marvel’s cosmic heroes. In the early 1960s, Marvel Comics stood out from DC by introducing grounded and realistic characters like Sp… [+10804 chars]"
,Gizmodo.com,Kyle Barr,PlayStation Permanently Suspends Online Accounts for No Clear Reason,"If you woke up recently to find that Sony has “permanently suspended” your PlayStation account for no apparent reason, just know you’re not alone. Sony has kicked an unknown number of PlayStation IDs off its platforms, ostensibly for violating the company’s t…",https://gizmodo.com/playstation-permanently-suspends-online-accounts-for-no-1851073635,"https://i.kinja-img.com/image/upload/c_fill,h_675,pg_1,q_80,w_1200/256d77d25e66fbce9e844848ce86df96.jpg",2023-12-05T16:00:00Z,"If you woke up recently to find that Sony has permanently suspended your PlayStation account for no apparent reason, just know youre not alone. Sony has kicked an unknown number of PlayStation IDs of… [+2172 chars]"
,/FILM,staff@slashfilm.com (Danielle Ryan),The One Thing Jennifer Lawrence Refused To Do For The Hunger Games,"Jennifer Lawrence refused to lose weight for The Hunger Games, knowing her character, Katniss Everdeen, would be a role model for many young people.",https://www.slashfilm.com/1452661/the-hunger-games-jennifer-lawrence-refused-weight-loss/,https://www.slashfilm.com/img/gallery/the-one-thing-jennifer-lawrence-refused-to-do-for-the-hunger-games/l-intro-1700597274.jpg,2023-11-27T06:00:56Z,"When Lawrence was set to play Katniss Everdeen, the hero at the center of ""The Hunger Games,"" she was asked to lose weight and she refused, telling SciFiNow:
""In the first movie, when it was obvious… [+1045 chars]"
,Forbes,"Jackie Gutierrez, Contributor, 
 Jackie Gutierrez, Contributor
 https://www.forbes.com/sites/jackiegutierrez/",What To Know About New Netflix Series On The USWNT World Cup Journey,"Despite the sting from the loss that put an end to the possibility of their three-peat victory, the world will now have an inside look of what went on behind the scene...",https://www.forbes.com/sites/jackiegutierrez/2023/12/05/what-to-know-about-new-netflix-series-on-the-uswnt-world-cup-journey/,https://imageio.forbes.com/specials-images/imageserve/656f6e2016b875f80534386a/0x0.jpg?format=jpg&height=900&width=1600&fit=bounds,2023-12-05T18:46:28Z,"The U.S. Womens National Team (USWNT) have not only won four World Cup Championships, but re-wrote FIFA history as they are the second country alongside Germany to win back to back World Cup Champion… [+4112 chars]"
